fecha,hora,pais,categoria_sicu,descripcion,localizacion,lat,lon,fuente_URL
2025-11-23,19:29:41,Gaza,Terrorismo,El ejército enemigo está documentando el momento en que bombardeó el suburbio sur de Beirut para violar al comandante de Hezbollah.,,,,@yaseenpress2004
2025-11-23,19:29:41,Gaza,Terrorismo,"El Vicepresidente del Consejo Político de Hizbollah, Mahmoud Qamati: después del bombardeo del barrio de hoy, todas las posibilidades están abiertas.",,,,@yaseenpress2004
2025-11-23,19:29:41,Gaza,Criminalidad,El ejército israelí anuncia oficialmente el asesinato de un médico,,,,@yaseenpress2004
2025-11-23,19:29:41,Gaza,Terrorismo,"El ejército israelí ha eliminado al terrorista Haytham Ali Tabrami, el verdadero líder de Hezbolá",,,,@yaseenpress2004
2025-11-23,19:42:54,Gaza,Terrorismo,:: Las autoridades ucranianas de Dnipro: dos muertos y varios heridos en un bombardeo ruso en la provincia,,,,@AjaNews
2025-11-23,19:42:56,Gaza,Terrorismo,"- El ejército israelí ha eliminado al terrorista Haytham Ali Al-Tabrafi, Jefe de Estado Mayor del Partido-Allah. Nos enfrentaremos a los intentos de rehabilitar y armar al partido-Allah y eliminaremos toda amenaza a Israel y a sus ciudadanos.",,,,@EabriLive
2025-11-23,19:42:56,Gaza,Conflicto Armado,"- Radio del ejército israelí: el Jefe de Estado Mayor, Ial Zamir, decide destituir al General de División de Inteligencia Militar, Teniente General de Brigada Aharon Haleva, ex Jefe de Inteligencia Operacional, Aidid Bassyuk, ex Comandante del Mando Sur, General de Brigada Yarun Finkelman, ex Comandante de la Unidad 8200, ex Comandante de Brigada de la División de Gaza, General de Brigada Avi Rosenfeld, ex Jefe de Estado Mayor del Mando Sur, Coronel Ariel Labowski, y al Comandante de la Brigada Norte de la División de Gaza, Coronel Haim Cohen, por su fracaso en los acontecimientos del 7 de...",Gaza City,31.520,34.450,@EabriLive
2025-11-23,19:42:59,Gaza,Conflicto Armado,"El estallido de enfrentamientos en la ciudad de Surif, al norte de Hebrón, y la ocupación lanza bombas de sonido.",,,,@yaseenpress2004
2025-11-23,19:44:58,Gaza,Conflicto Armado,"El director de la oficina de Al-Jazeera en Palestina, Walid Al-Omri, dijo esta tarde que la información que circulaba indicaba que Israel tenía una clara cobertura estadounidense para seguir intensificando sus operaciones militares en el Líbano, a cambio de una reducción de las tensiones en la Franja de Gaza, y afirmó que la organización de seguridad israelí no esperaba una respuesta sustancial de Hizbollah al asesinato de un destacado dirigente en la zona meridional del Líbano.  [Enlace: https://www.alquds.com/ar/posts/211175]",Gaza City,31.520,34.450,WEB www.alquds.com
2025-11-23,19:49:54,Gaza,Hazards,":: Ha ' aretz: La fiscalía presentó hoy un auto de acusación contra un colono israelí, acusado de haber participado con docenas de colonos en el incendio deliberado de la aldea de Beit Lid a principios de este mes. Según la fiscalía, el objetivo de los atacantes era ""aterrorizar a los habitantes de la aldea y poner en grave peligro sus vidas y bienes"".",,,,@EabriLive
2025-11-23,19:50:56,Gaza,Hazards,"El Ministerio Público presentó hoy un auto de acusación contra un colono israelí, acusado de haber participado con docenas de colonos en el incendio deliberado de la aldea de Beit Lid a principios de este mes. Según el fiscal, el objetivo de los atacantes era ""aterrorizar a los habitantes de la aldea y poner en grave peligro sus vidas y bienes"".",,,,@hamza20300
2025-11-23,20:06:05,Gaza,Criminalidad,"Páginas israelíes en las páginas libanesas, una foto que dice que es del comandante del estado mayor de Hizbollah Haytham el Doctor después de su asesinato.",,,,@yaseenpress2004
2025-11-23,20:18:04,Gaza,Conflicto Armado,"Urgentemente, Netanyahu: esperamos que el gobierno libanés desmilitarice al Partido de Dios.",,,,@AjaNews
2025-11-23,20:18:05,Gaza,Conflicto Armado,- Netanyahu: Esperamos que el Gobierno del Líbano desmilitarice al Partido de Dios. - No permitiremos que el Partido de Dios vuelva a ser una amenaza y espero que el Gobierno del Líbano cumpla sus obligaciones y compromisos.,,,,@EabriLive
2025-11-23,20:18:05,Gaza,Criminalidad,"• Hebreo Life, Canal 12 Hebreo, Oficial de los Estados Unidos: no hemos escuchado ninguna protesta del Gobierno del Líbano por el asesinato de Tababi",,,,@EabriLive
2025-11-23,20:18:10,Gaza,Criminalidad,"* Un movimiento activo de máquinas y topadoras de ocupación al este del barrio de Al-Tuffah, precisamente al comienzo de la calle Shu ' af, que se espera que lleven a cabo operaciones de excavación, saturación o detonación de robots para su posterior detonación por la noche en las próximas horas.",,,,@yaseenpress2004
2025-11-23,20:18:11,Gaza,Hazards,Meteorología de Gaza lluviosa y tormentas eléctricas a medianoche.,Gaza City,31.520,34.450,@yaseenpress2004
2025-11-23,20:20:08,Gaza,Hazards,"Se espera que el martes, por la voluntad de Dios, haya lluvias torrenciales con tormentas eléctricas, descargas eléctricas y polvorientas en muchas zonas. Antes de eso, en algunas zonas, las posibilidades de que se desplome un trueno radiador se multiplican en las últimas horas del lunes.",,,,@yaseenpress2004
2025-11-23,20:28:10,Gaza,Terrorismo,"El vicepresidente del consejo político de Hizbollah, Mahmoud Qamati, después del bombardeo del barrio de hoy, todas las posibilidades están abiertas.",,,,@yaseenpress2004
2025-11-23,20:28:10,Gaza,Conflicto Armado,"El cuerpo del mártir es un mártir de Ma ' li ' ar, que recibió disparos de la ocupación durante el enfrentamiento a los colonos en la aldea de Deir Greer, al noreste de Ramallah.",,,,@yaseenpress2004
2025-11-23,20:32:06,Gaza,Conflicto Armado,"Hamas: Condenamos la flagrante agresión contra el barrio meridional y la clara violación de la soberanía libanesa, con el objetivo de llevar al Líbano y a la región a un enfrentamiento que sólo sirve a los intereses de la ocupación, en el marco de la búsqueda de nuevas ecuaciones y de la presión sobre las fuerzas de resistencia.",,,,@yaseenpress2004
2025-11-23,20:35:02,Gaza,Conflicto Armado,El ataque contra Beirut es una clara violación de la soberanía y tiene por objeto arrastrar al Líbano y a la región hacia un enfrentamiento que sólo sirve a los intereses de la ocupación.,,,,@AjaNews
2025-11-23,20:35:06,Gaza,Conflicto Armado,"Condenamos la agresión sionista contra el barrio meridional de Beirut y afirmamos que se trata de una agresión descontrolada y una clara violación de la soberanía libanesa, cuyo objetivo es arrastrar al Líbano y a la región a un enfrentamiento que sólo sirve a los intereses de la ocupación. - El ataque contra una zona densamente poblada a plena luz del día refleja la naturaleza del terrorismo organizado de la ocupación y de sus dirigentes criminales, así como la búsqueda de nuevas ecuaciones y la presión sobre las fuerzas de la resistencia.",,,,@hamza20300
2025-11-23,20:47:45,Gaza,Hazards,"Se espera que el martes, por la voluntad de Dios, haya lluvias torrenciales con tormentas eléctricas, descargas eléctricas y polvorientas en muchas zonas. Antes de eso, en algunas zonas, las posibilidades de que se produzca una lluvia de truenos intermitentes aumentan en las últimas horas del lunes.",,,,@yaseenpress2004
2025-11-23,22:20:31,Gaza,Conflicto Armado,"El periódico hebreo ""Diakot Ahronut"", el domingo, dijo que en Tel Aviv estaba preparado para lo que describió como “guerras renovadas” en la Franja de Gaza, el Líbano y el Irán, señalando que “Israel no está seguro de que los Estados Unidos entiendan esa disposición”. El periódico dijo: “En vista de la cesación del fuego con Hamas en la Franja de Gaza y el Líbano y el Partido de Dios en el Líbano, los soldados de Israel siguen manteniendo un alto el fuego en el Líbano, pero en la práctica se han producido grandes ataques en ambos lados, incluido el asesinato de un alto mando militar de Hama...  [Enlace: https://www.alquds.com/ar/posts/211196]",Gaza City,31.520,34.450,WEB www.alquds.com
