id,pais,categoria,descripcion,fuente,lat,lon,mgrs,place,admin1,admin2,accuracy,geocode_source,created_at,updated_at
576,gaza,Sin clasificar,• Alto funcionario estadounidense de la isla: consultas intensivas sobre el proyecto de resolución con los israelíes,@AjaNews,44.108946,8.003074,32TMP2021884456,Alto,Piemonte,Cuneo,administrative,nominatim,2025-11-06T18:44:14,2025-11-06T18:44:14
577,gaza,Sin clasificar,• Alto funcionario de los Estados Unidos de América en la isla: intensas consultas sobre el proyecto de resolución con israelíes y diplomáticos palestinos en Nueva York,@AjaNews,,,,isla: intensas consultas sobre el proyecto de resolución con israelíes y diplomáticos palestinos en Nueva York,,,,mensajes,2025-11-06T18:46:14,2025-11-06T18:46:14
578,gaza,Sin clasificar,Un alto funcionario estadounidense de la isla: la cesación del fuego en Gaza es ahora muy frágil y recordaremos permanentemente a los miembros del Consejo de Seguridad la alternativa.,@AjaNews,,,,Gaza es ahora muy frágil y recordaremos permanentemente a los miembros del Consejo de Seguridad la alternativa,,,,mensajes,2025-11-06T18:48:14,2025-11-06T18:48:14
579,gaza,Sin clasificar,"En el transcurso de los días, la lista de prisioneros de guerra comenzó a mostrarse poco a poco, pero era muy difícil identificar a las familias de Gaza: las que seguían vivas, las que habían sido transportadas a los túneles, las que habían permanecido aisladas de los cadáveres, unos pocos días después de ser capturadas por una organización asesina.",@EabriLive,,,,transcurso de los días,,,,mensajes,2025-11-06T18:49:14,2025-11-06T18:49:14
580,gaza,Sin clasificar,"Un alto funcionario estadounidense de la isla: no hay un plan perfecto, pero esta es la mejor manera de seguir adelante y sabemos que es diferente de lo que se dijo sobre Gaza.",@AjaNews,,,,Un alto funcionario estadounidense de la isla,,,,mensajes,2025-11-06T18:50:14,2025-11-06T18:50:14
581,gaza,Conflicto Armado,Bombardeo de artillería israelí contra el valle de Zibqin en el sur del Líbano,@GazaNewsNow,33.272121,35.196402,36SYB0456683606,sur del Líbano,محافظة الجنوب,صور,administrative,cache,2025-11-06T18:50:14,2025-11-06T18:50:14
582,gaza,Sin clasificar,":: Hebreo Life Canal 12 Hebreo: las autoridades británicas detienen a una persona presuntamente deseada por Hamas y planean realizar operaciones contra los judíos en Alemania, tras la emisión de una orden de detención contra él en Alemania con las recomendaciones del Mossad.",@EabriLive,51.163818,10.447831,32UPB0123369038,Alemania,,,administrative,nominatim,2025-11-06T18:52:14,2025-11-06T18:52:14
583,gaza,Sin clasificar,"Alá les ha dado un fuego sobre ellos y su tierra está bajo el poder de Alá, y les ha cortado el suministro de sus armas. Dios les ha dado las manos para que se peleen entre ellos y expien unos a otros hasta que se disuelva su país. La sal se derrite en el agua. Los que luchan en el Líbano y en Gaza , y el Yemen , Alá ha hecho que se queden en la tierra .",@Warlife3,42.875800,-1.725415,30TXN0409847810,agua,,Iruñerria / Comarca de Pamplona,peak,nominatim,2025-11-06T18:52:14,2025-11-06T18:52:14
584,gaza,Sin clasificar,":: La Autoridad de Radiodifusión de Israel, encargada de los ataques en el Líbano, en coordinación con los Estados Unidos",@AjaNews,33.875063,35.843409,36SYC6300751942,Líbano,,,administrative,cache,2025-11-06T18:53:14,2025-11-06T18:53:14
585,gaza,Sin clasificar,La Autoridad de Radiodifusión de Israel está trabajando a un ritmo más lento de lo que se esperaba para desarmar a Hizbollah,@AjaNews,-16.501500,-68.132487,19KEB9258475391,Autoridad,La Paz,Pedro Domingo Murillo,government,cache,2025-11-06T18:54:14,2025-11-06T18:54:14
586,gaza,Sin clasificar,"La Autoridad de Radiodifusión de Israel tiene responsabilidades: si las Fuerzas Armadas Libanesas no se apresuran a desarmar a Hizbollah, Israel lo hará.",@AjaNews,,,,Autoridad de Radiodifusión de Israel tiene responsabilidades,,,,mensajes,2025-11-06T18:55:14,2025-11-06T18:55:14
587,gaza,Sin clasificar,"El equipo de inspección israelí de la zona meridional del Líbano continuó la escalada de los ataques israelíes contra cuatro ciudades del Líbano meridional y los ataques reiterados de la cesación del fuego contra el ejército israelí en la última noche del jueves, una serie de ataques aéreos contra las localidades de Tayr Daba, Taiba, Ayta al-Ŷabal y Zawtar al-Sharqiya al sur del Líbano, después...",WEB www.alquds.com,,,,última noche del jueves,,,,mensajes,2025-11-06T18:55:45,2025-11-06T18:55:45
588,gaza,Sin clasificar,- Te añadieron.,@GazaNewsNow,,,,,,,,mensajes,2025-11-06T18:56:15,2025-11-06T18:56:15
589,gaza,Sin clasificar,"En las últimas 24 horas, Israel ha observado una actividad excesiva de Hizbollah y intentos de organizar la reconstrucción de la infraestructura, el contrabando de cohetes y el reclutamiento de nuevos elementos, incluso en las filas de la fuerza “Rahwan”, especialmente en el Líbano.",@EabriLive,,,,últimas 24 horas,,,,mensajes,2025-11-06T18:58:14,2025-11-06T18:58:14
590,gaza,Sin clasificar,"El ejército libanés trabaja a un ritmo más lento de lo esperado en el desarme de Hizb-Allah. Si el ejército libanés no acelera el desarme de Hizb-Allah, Israel lo hará.",@EabriLive,,,,desarme de Hizb-Allah,,,,mensajes,2025-11-06T18:59:14,2025-11-06T18:59:14
591,gaza,Sin clasificar,"A primera vista, pensará que la vida ha vuelto a la normalidad después de dos años de guerra genocida “Israel”, con estantes llenos de galletas y dulces. ¿Ha terminado la hambruna?",@GazaNewsNow,30.812425,34.859476,36RXV7787810293,Israel,,,administrative,cache,2025-11-06T19:00:14,2025-11-06T19:00:14
592,gaza,Sin clasificar,"Canal 12 hebreo: En la policía israelí se está estudiando la posibilidad de poner en libertad a la ex fiscal militar mañana, en condiciones restrictivas.",@EabriLive,31.932489,34.884966,36RXA7818934503,policía israelí se,מחוז המרכז,,police,nominatim,2025-11-06T19:02:14,2025-11-06T19:02:14
593,gaza,Sin clasificar,El pequeño Consejo de Ministros de Israel “El Capnit” está examinando los acontecimientos con el Líbano y el expediente de la entrada de la Fuerza Internacional en Gaza. https://t.me/Almustashar,@Almustashaar,-23.328398,32.806606,36KVV8022820112,Gaza,Gaza,,administrative,cache,2025-11-06T19:03:14,2025-11-06T19:03:14
594,gaza,Sin clasificar,Los ataques en el Líbano se llevan a cabo en coordinación con las Fuerzas Armadas Libanesas a un ritmo más lento de lo que se esperaba.,@muthanapress84,,,,Líbano se llevan a cabo en coordinación con las Fuerzas Armadas Libanesas a un ritmo más lento de lo,,,,mensajes,2025-11-06T19:04:15,2025-11-06T19:04:15
595,gaza,Sin clasificar,"En Israel, se dice que su ritmo de actividad es más lento de lo previsto en vista de los desafíos internos libaneses y de la presencia de batallones chiítas en el ejército libanés. Hay lugares en los que el ejército no entra. Si el ejército libanés no acelera sus operaciones y trabaja para desarmar a Hizbollah, Israel lo hará.",@Almustashaar,30.812425,34.859476,36RXV7787810293,Israel,,,administrative,cache,2025-11-06T19:05:14,2025-11-06T19:05:14
596,gaza,Sin clasificar,"El Primer Ministro de Israel, Benjamin Netanyahu, dijo que en los últimos años Turquía había adoptado una actitud muy hostil contra Israel y los sionistas.",WEB www.alquds.com,,,,últimos años Turquía había adoptado una actitud muy hostil contra Israel y los sionistas,,,,mensajes,2025-11-06T19:05:57,2025-11-06T19:05:57
597,gaza,Sin clasificar,El ejército libanés se niega a evacuar un cuartel militar junto a una posición en la que el ejército israelí emitió una advertencia en una fosa de Dunin y un intento de la FPNUL de convencer a los oficiales del ejército libanés de que lo evacuaran.,@Almustashaar,,,,una posición en la,,,,mensajes,2025-11-06T19:06:15,2025-11-06T19:06:15
598,gaza,Sin clasificar,"Las fuerzas de ocupación están reteniendo un vehículo durante la incursión en la ciudad de Al Mugir, al noreste de Ramallah.",@GazaNewsNow,35.410459,36.487831,37SBV7188621461,Al Mugir,محافظة حماة,,village,nominatim,2025-11-06T19:06:16,2025-11-06T19:06:16
599,gaza,Sin clasificar,"Las Fuerzas Armadas Libanesas se niegan a evacuar la instalación de Mohamed Farhat, situada a 200 metros del objetivo que el portavoz del ejército israelí ordenó evacuar.",@EabriLive,35.869419,10.570371,32SPE4177270603,Mohamed Farhat,ولاية سوسة,أكودة الشرقية,school,nominatim,2025-11-06T19:07:15,2025-11-06T19:07:15
600,gaza,Criminalidad,"El Movimiento de Resistencia Islámica (Hamás) ha condenado enérgicamente la continua y criminal agresión sionista contra aldeas y pueblos del sur del Líbano, dirigida contra civiles indefensos, afirmando que constituye un nuevo crimen de guerra contra los pueblos de nuestra nación.",@GazaNewsNow,,,,Movimiento de Resistencia Islámica (Hamás,,,,mensajes,2025-11-06T19:08:15,2025-11-06T19:08:15
601,gaza,Sin clasificar,"Las Fuerzas Armadas Libanesas se niegan a evacuar un cuartel militar situado cerca de una posición a la que el ejército israelí ha dado una advertencia en la zona de Fara Donen, en medio de movimientos de las fuerzas de la FPNUL para tratar de convencer a los oficiales de las Fuerzas Armadas Libanesas de que respondan.",@Warlife3,,,,zona de Fara Donen,,,,mensajes,2025-11-06T19:08:15,2025-11-06T19:08:15
602,gaza,Sin clasificar,Hablar rápido en ev a través de Instagram ahora. https://www.instagram.com/hamza1987.8.31.,@hamza20300,,,,ev a través de Instagram ahora,,,,mensajes,2025-11-06T19:08:15,2025-11-06T19:08:15
603,gaza,Sin clasificar,Ministerio de Información del Pakistán: fuerzas afganas dispararon contra el cruce de Chemin-Spen Poldak y nuestras fuerzas respondieron de manera deliberada y responsable,@AjaNews,24.795130,-107.412311,13RBH5612544416,Información,Sinaloa,Culiacán,house,cache,2025-11-06T19:10:14,2025-11-06T19:10:14
604,gaza,Sin clasificar,"• La elección del Presidente del Gobierno, Benjamin Netanyahu, como Presidente del Partido Likud y su candidato a la Presidencia del Gobierno en las próximas elecciones, después de que nadie más presentara su candidatura ante él.",@EabriLive,,,,próximas elecciones,,,,mensajes,2025-11-06T19:11:14,2025-11-06T19:11:14
605,gaza,Sin clasificar,:: Transitorio de Life: Serael Hume: después de la ola de ataques aéreos en el sur del Líbano; en Israel esperan que Hezbolá responda a esos ataques.,@EabriLive,33.272121,35.196402,36SYB0456683606,sur del Líbano,محافظة الجنوب,صور,administrative,cache,2025-11-06T19:13:14,2025-11-06T19:13:14
606,gaza,Sin clasificar,":: El proyecto de nueva Ley de reclutamiento incluye sanciones contra los que huyen del servicio militar, como la revocación del permiso de conducir, la prohibición de viajar del país y la denegación de la educación superior.",@EabriLive,48.736280,6.657210,32ULV2774500787,Ley,Grand Est,Moselle,administrative,cache,2025-11-06T19:15:22,2025-11-06T19:15:22
607,gaza,Sin clasificar,"- En el canal hebreo 13, en medio de la tensión en el norte, se llevó a cabo una maniobra militar en gran escala en Haifa, simulando el lanzamiento de cohetes.",@EabriLive,32.819122,34.998386,36SXB8707633003,Haifa,מחוז חיפה,,administrative,nominatim,2025-11-06T19:16:16,2025-11-06T19:16:16
608,gaza,Sin clasificar,"* Seguimiento de Israel Hume: el nuevo proyecto de ley de reclutamiento contiene sanciones contra los que se desvían del servicio militar, como la revocación de la licencia de conducir, la prohibición de viajar del país y la denegación de la educación superior.",@GazaNewsNow,40.454925,-4.170138,30TVK0078278908,Seguimiento,Comunidad de Madrid,,military,cache,2025-11-06T19:16:16,2025-11-06T19:16:16
609,gaza,Sin clasificar,"Urgentemente, Trump: Los derechos de aduana son muy importantes, y si el Tribunal Supremo decide negativamente sobre ellos, será muy devastador para nuestro país.",@AjaNews,,,,Urgentemente,,,,mensajes,2025-11-06T19:18:17,2025-11-06T19:18:17
610,gaza,Sin clasificar,"Urgentemente, Trump: Los medicamentos se volverán a fabricar dentro de los Estados Unidos gracias a los derechos de aduana.",@AjaNews,,,,Urgentemente,,,,mensajes,2025-11-06T19:19:17,2025-11-06T19:19:17
611,gaza,Sin clasificar,• Hebreo Life: Los Estados Unidos de América advierten al Líbano: no se convertirán en un Estado libre sin el desarme de Hezbolá.,@EabriLive,,,,un Estado libre sin el desarme de Hezbolá,,,,mensajes,2025-11-06T19:21:14,2025-11-06T19:21:14
612,gaza,Sin clasificar,"• Hebrea Life: Yair Labed atacó al gobierno en el contexto de la investigación contra la fiscal militar saliente Yifat Tumer Erushali: ""Esto es un ataque contra Israel, la democracia y el estado de derecho.",@EabriLive,,,,"contexto de la investigación contra la fiscal militar saliente Yifat Tumer Erushali: ""Esto es un ataque contra Israel",,,,mensajes,2025-11-06T19:22:33,2025-11-06T19:22:33
613,gaza,Sin clasificar,"□ Amit Sigal, corresponsal del canal 12: Si se inicia una nueva campaña en el Líbano, esta vez el objetivo será acabar con Hizbollah.",@EabriLive,33.875063,35.843409,36SYC6300751942,Líbano,,,administrative,cache,2025-11-06T19:23:14,2025-11-06T19:23:14
614,gaza,Sin clasificar,El enviado estadounidense Steve Witkov: Esperamos que Hamas cumpla su promesa de desarmarse,@AjaNews,,,,enviado estadounidense Steve Witkov,,,,mensajes,2025-11-06T19:26:14,2025-11-06T19:26:14
615,gaza,Sin clasificar,Enviado de los Estados Unidos Steve Witkov: Esta tarde anunciaré la adhesión de un nuevo país a los acuerdos de Abraham.,@AjaNews,,,,Enviado de los Estados Unidos Steve Witkov,,,,mensajes,2025-11-06T19:27:14,2025-11-06T19:27:14
616,gaza,Sin clasificar,"□ Urgente: A través de Lee Liv y Witkov, anunciaremos esta noche la adhesión de un nuevo Estado a los acuerdos de Abraham y la normalización con Israel",@EabriLive,41.672999,-0.890050,30TXM7563715621,Urgente,Aragón,Zaragoza,administrative,cache,2025-11-06T19:27:14,2025-11-06T19:27:14
617,gaza,Sin clasificar,"Dos años después del inicio de la agresión contra Gaza, la guerra ha causado un gran número de víctimas a la población inocente de Gaza. La población de Gaza ha desaparecido por completo, no ha sido reconocida por los ataques y los hospitales se han derrumbado, no ha podido prestar asistencia y los organismos humanitarios han quedado solos en medio de la crisis del hambre.",@GazaNewsNow,,,,medio de la crisis del hambre,,,,mensajes,2025-11-06T19:28:14,2025-11-06T19:28:14
618,gaza,Sin clasificar,"El Servicio de Inteligencia Nacional de Austria descubrió un depósito de armas en Viena sospechoso de estar vinculado a Hamas, que se proponía utilizar para ""posibles ataques contra instituciones israelíes o judías en Europa"" (https://t.me/Almastashar).",@Almustashaar,,,,Viena sospechoso de estar vinculado a Hamas,,,,mensajes,2025-11-06T19:29:14,2025-11-06T19:29:14
619,gaza,Sin clasificar,} Enviado de EE.UU. Steve Witkov: el plan de desarrollo que hemos elaborado para una Gaza maravillosa y mejor que cualquier plan anterior,@AjaNews,51.920882,7.853188,32UMC2113352859,Enviado,Nordrhein-Westfalen,Kreis Warendorf,company,nominatim,2025-11-06T19:30:14,2025-11-06T19:30:14
620,gaza,Sin clasificar,"Esta tarde anunciaré la adhesión de un nuevo país a los acuerdos de Abraham, y declaro que Dios los avergüence.",@Almustashaar,56.297235,12.852847,33VUC6712841233,Esta,,Skåne län,aerodrome,cache,2025-11-06T19:31:14,2025-11-06T19:31:14
621,gaza,Sin clasificar,Incursiones violentas contra el lugar de Kafr Dunin en el Líbano meridional,@Almustashaar,33.338641,35.302252,36SYB1426491196,Líbano meridional,محافظة الجنوب,,administrative,cache,2025-11-06T19:33:11,2025-11-06T19:33:11
622,gaza,Sin clasificar,- El enviado estadounidense Steve Witkov: el plan de desarrollo que hemos elaborado para una Gaza maravillosa y mejor que cualquier otro plan anterior,@EabriLive,,,,Steve Witkov,,,,mensajes,2025-11-06T19:33:12,2025-11-06T19:33:12
623,gaza,Sin clasificar,:: A través de Life y Whitcoff: esperamos que Hamas cumpla su promesa de desarmar al movimiento,@EabriLive,35.614516,-88.478661,16SCE6608142200,Life,Tennessee,Henderson County,hamlet,cache,2025-11-06T19:33:12,2025-11-06T19:33:12
624,gaza,Sin clasificar,El Enviado de los Estados Unidos Steve Witkov: La solución del conflicto entre Rusia y Ucrania es un paso importante en el que trabajaremos después de que se ponga fin a la guerra de Gaza,@AjaNews,,,,Enviado de los Estados Unidos Steve Witkov,,,,mensajes,2025-11-06T19:34:14,2025-11-06T19:34:14
625,gaza,Sin clasificar,"WITKOV: Estamos trabajando en el proceso de desarme de Hamas, que dijo que necesitaría que las fuerzas internacionales le entregaran las armas.",@AjaNews,,,,proceso de desarme de Hamas,,,,mensajes,2025-11-06T19:35:20,2025-11-06T19:35:20
626,gaza,Sin clasificar,El asunto de los combatientes de Hamas atrapados en Rafah será una prueba para el desarme.,@AjaNews,31.275205,34.255827,36RXV1954760782,Rafah,قطاع غزة,,administrative,cache,2025-11-06T19:37:14,2025-11-06T19:37:14
627,gaza,Sin clasificar,Hay modelos de acuerdos regionales como la fuerza multinacional y los observadores en el Sinaí.,@AjaNews,29.523170,33.805473,36RWT7805666221,Sinaí,,,peninsula,nominatim,2025-11-06T19:38:14,2025-11-06T19:38:14
628,gaza,Sin clasificar,"• Alto funcionario estadounidense de la isla: si tenemos que aprobar un acuerdo regional sobre Gaza, preferimos trabajar a través de las Naciones Unidas",@AjaNews,44.108946,8.003074,32TMP2021884456,Alto,Piemonte,Cuneo,administrative,cache,2025-11-06T19:39:14,2025-11-06T19:39:14
629,gaza,Sin clasificar,"- A través de la frontera de Life, Mifzaki Raim: un niño palestino resultó herido como consecuencia de la agresión que el colono perpetró hoy contra él en Hebrón.",@EabriLive,31.528902,35.094487,36RXV9886090121,Hebrón,الضفة الغربية,אזור H1,administrative,cache,2025-11-06T19:39:14,2025-11-06T19:39:14
630,gaza,Sin clasificar,"• Alto funcionario estadounidense de la isla: todos los planes para Gaza están listos para la aprobación del proyecto de resolución, que es una prueba para las Naciones Unidas",@AjaNews,44.108946,8.003074,32TMP2021884456,Alto,Piemonte,Cuneo,administrative,cache,2025-11-06T19:41:14,2025-11-06T19:41:14
631,gaza,Sin clasificar,"• La posición hebrea de Wala: el comandante de la región septentrional del ejército: ""Tenemos que estar decididos a continuar el ataque y la destrucción para debilitar a Hizbollah. No vamos a permitir que Hezbolá consolide su presencia, organice sus filas y se recupere. Seguiremos trabajando, vigilando cualquier amenaza que veamos y actuando en su contra.",@EabriLive,53.809381,9.966630,32UNE6365062746,su contra,Schleswig-Holstein,Kreis Segeberg,sports,nominatim,2025-11-06T19:42:15,2025-11-06T19:42:15
632,gaza,Conflicto Armado,*El Cuerpo de Fuerzas Armadas de la República Islámica del Irán le pidió a la gente del oeste del país que no fotografiara los movimientos de misiles y defensa aérea*,@Almustashaar,-14.874596,-74.929059,18LWJ0763155542,Cuerpo,Ica,,bare_rock,nominatim,2025-11-06T19:43:14,2025-11-06T19:43:14
633,gaza,Sin clasificar,• Alto funcionario de los Estados Unidos de América en la isla: esperamos con interés la votación del proyecto de resolución sobre Gaza en un plazo de semanas y proceder rápidamente,@AjaNews,,,,isla: esperamos con interés la votación del proyecto de resolución sobre Gaza en un plazo de semanas y proceder rápidamente,,,,mensajes,2025-11-06T19:44:17,2025-11-06T19:44:17
634,gaza,Sin clasificar,"Un alto funcionario estadounidense de la isla: la gente de Gaza necesita ayuda, la gente de Israel necesita seguridad y Hamas ha acordado desarmarla.",@AjaNews,,,,Un alto funcionario estadounidense de la isla,,,,mensajes,2025-11-06T19:44:17,2025-11-06T19:44:17
635,gaza,Sin clasificar,:: Transitorio de Life: Amit Segal - Canal 12: Indicaciones de que el Estado que imprimirá sus relaciones con Israel es Kazajstán.,@EabriLive,19.083668,-98.178656,14QNG8640510287,Transitorio,Puebla,Municipio de Puebla,residential,nominatim,2025-11-06T19:44:17,2025-11-06T19:44:17
636,gaza,Sin clasificar,"• Transitorio Leif, corresponsal de la Casa Blanca, Sr. Israel Hume: la ampliación puede ser simbólica para incluir a Azerbaiyán, que ya tiene relaciones con Israel",@EabriLive,,,,Transitorio Leif,,,,mensajes,2025-11-06T19:44:17,2025-11-06T19:44:17
637,gaza,Sin clasificar,• Alto funcionario estadounidense de la isla: tenemos mecanismos de financiación que trabajan con el Banco Mundial y están dispuestos a trabajar de inmediato en Gaza,@AjaNews,-23.328398,32.806606,36KVV8022820112,Gaza,Gaza,,administrative,cache,2025-11-06T19:45:14,2025-11-06T19:45:14
638,gaza,Sin clasificar,• Alto funcionario estadounidense de la isla: tenemos un tecnócrata dispuesto a trabajar de inmediato para restablecer los servicios gubernamentales en Gaza,@AjaNews,-23.328398,32.806606,36KVV8022820112,Gaza,Gaza,,administrative,cache,2025-11-06T19:45:14,2025-11-06T19:45:14
639,gaza,Sin clasificar,□ Hebreo Life Canal 12 Hebreo: El Estado es el Carkhistán,@EabriLive,,,,Hebreo Life Canal,,,,mensajes,2025-11-06T19:45:14,2025-11-06T19:45:14
640,gaza,Sin clasificar,• Alto funcionario de los Estados Unidos de América en la isla: tenemos países dispuestos a aportar fondos para la reconstrucción de Gaza,@AjaNews,,,,isla: tenemos países dispuestos a aportar fondos para la reconstrucción de Gaza,,,,mensajes,2025-11-06T19:46:14,2025-11-06T19:46:14
641,gaza,Sin clasificar,"""Azerbaiján, Kazajistán, ¿podrían los musulmanes sunnitas dejar de ser musulmanes?",@Almustashaar,40.393629,47.787251,38TQK3656275178,Azerbaiján,,,administrative,nominatim,2025-11-06T19:46:15,2025-11-06T19:46:15
642,gaza,Terrorismo,"Un vehículo de colonos resultó dañado por el lanzamiento de piedras en la ciudad de Hawara, al sur de Naplusa.",@GazaNewsNow,26.819285,37.905216,37RCK9120366888,Hawara,منطقة المدينة المنورة,,peak,nominatim,2025-11-06T19:47:16,2025-11-06T19:47:16
643,gaza,Sin clasificar,El Presidente del Líbano: lo que Israel ha hecho hoy en el sur del Líbano es un crimen consumado de conformidad con el derecho internacional y un crimen político abominable.,@AjaNews,,,,sur del Líbano es un crimen consumado de conformidad con el derecho internacional y un crimen político abominable,,,,mensajes,2025-11-06T19:48:14,2025-11-06T19:48:14
644,gaza,Sin clasificar,"El Presidente del Líbano: Cada vez que expresamos nuestra apertura a la negociación pacífica, Israel continúa su agresión",@AjaNews,33.875063,35.843409,36SYC6300751942,Líbano,,,administrative,cache,2025-11-06T19:48:14,2025-11-06T19:48:14
645,gaza,Sin clasificar,:: El Estado de Kazajstán ya mantiene relaciones diplomáticas con Israel.,@EabriLive,31.443223,34.360007,36RXV2923579524,Estado,قطاع غزة,,administrative,cache,2025-11-06T19:48:15,2025-11-06T19:48:15
646,gaza,Sin clasificar,":: Witkov: Esta noche anunciaremos la adhesión de un nuevo Estado a los acuerdos de Abraham y la normalización con Israel, mientras que el canal hebreo 12 dice que el país en cuestión es Kazajstán.",@Warlife3,,,,cuestión es Kazajstán,,,,mensajes,2025-11-06T19:48:15,2025-11-06T19:48:15
647,gaza,Sin clasificar,"Información israelí: El Estado que declarará la normalización, la adhesión a la religión y el acuerdo de Abraham es Kazajstán. https://t.me/Almustashar",@Almustashaar,,,,Información israelí,,,,mensajes,2025-11-06T19:49:14,2025-11-06T19:49:14
648,gaza,Sin clasificar,"El Presidente del Líbano: Desde el acuerdo de cesación del fuego, Israel no ha escatimado esfuerzos para rechazar una solución negociada",@AjaNews,33.875063,35.843409,36SYC6300751942,Líbano,,,administrative,cache,2025-11-06T19:50:15,2025-11-06T19:50:15
649,gaza,Sin clasificar,□ Axio por funcionarios estadounidenses: se espera que el Presidente de Kazajstán declare en una reunión con el Trump la adhesión a las convenciones de Abraham,@AjaNews,,,,una reunión con el Trump la adhesión a las convenciones de Abraham,,,,mensajes,2025-11-06T19:52:14,2025-11-06T19:52:14
650,gaza,Sin clasificar,Se ha creado un equipo con la impresión de dólares de sus giras y se ha creado un grupo con un botiquín diario de 200 a 300 pips si se une a una familia cuyo objetivo es la libertad financiera dando a cada persona un plan financiero para su cuenta.,@Almustashaar,,,,Ahmed OmarFx,,,,mensajes,2025-11-06T19:52:14,2025-11-06T19:52:14
651,gaza,Sin clasificar,El ejército israelí anuncia la culminación de la ola de ataques contra el Líbano,@hamza20300,33.875063,35.843409,36SYC6300751942,Líbano,,,administrative,cache,2025-11-06T19:52:14,2025-11-06T19:52:14
652,gaza,Sin clasificar,"• El sitio web del blog de Abu Ali al-Hibri: Witkov: ""El caso de los elementos de Hamas que se encuentran en Rafah pondrá a prueba la causa del desarme de Hamas"".",@EabriLive,,,,Rafah pondrá a prueba la causa del desarme de Hamas,,,,mensajes,2025-11-06T19:53:14,2025-11-06T19:53:14
653,gaza,Sin clasificar,Watkov: Hoy vimos una oferta de cesación del fuego en el Sudán por una de las partes en el conflicto,@AjaNews,,,,Sudán por una de las partes,,,,mensajes,2025-11-06T19:54:14,2025-11-06T19:54:14
