id,pais,categoria,descripcion,fuente,lat,lon,mgrs,place,admin1,admin2,accuracy,geocode_source,created_at,updated_at
894,haiti,Sin clasificar,Soti nan divèsyon eleksyon tonbe nan divèsyon sèkstoy! Epi sa w tande a fokis pèp la pa sou 9 manb KPT yo jou sa yo. #DonSamy,@machannzen,,,,DonSamy,,,,mensajes,2025-11-06T16:21:29,2025-11-06T16:21:29
895,haiti,Sin clasificar,Yap ba nou distraksyon! Pou n bliye fokis sou vrè sous pwoblèm nou ye ladan l kounye a. #DonSamy,@machannzen,,,,DonSamy,,,,mensajes,2025-11-06T16:22:29,2025-11-06T16:22:29
896,haiti,Sin clasificar,📰 Haiti - News : Zapping... https://www.haitilibre.com/en/news-46153-haiti-news-zapping.html,@HaitiLibre,19.139995,-72.357097,18QYG7800918421,Haiti,,,administrative,cache,2025-11-06T17:54:26,2025-11-06T17:54:26
897,haiti,Sin clasificar,Haití - Noticias: Zapping https://www.haitilibre.com/article-46153-haiti-actualite-zapping.html,@HaitiNewsExpress,19.139995,-72.357097,18QYG7800918421,Haití,,,administrative,cache,2025-11-06T17:54:26,2025-11-06T17:54:26
898,haiti,Sin clasificar,"La FAAA reduce el número de vuelos en 40 grandes aeropuertos debido al shutdow del Gobierno: véase la lista - Rezo Nòdwès https://renonododwes.com/?p=368884 La FAAA reduce el número de vuelos en 40 grandes aeropuertos debido al shutdowwww del Gobierno: véase la lista La Federal Aviation Aviación Administración (FAA) reducirá la capacidad de vuelo en un 10 % en 40 grandes aeropuertos del país, t...",WEB rezonodwes.com,,,,un 10 % en 40 grandes aeropuertos del país,,,,mensajes,2025-11-06T17:56:56,2025-11-06T17:56:56
899,haiti,Sin clasificar,"El 10 de noviembre - Rezo Nòdwès https://renononodowes.com/?p=368882 Haití IBC Airlines inaugura su primer vuelo con pasajeros entre Miami y Les Cayes el 10 de noviembre - Rezo Nòdwès https://renononododwes.com/?p=368882 Haití IBC Airlines inaugura su primer vuelo con pasajeros entre Miami y Les Cayes el 10 de noviembre Miami, 6 de noviembre de 2025 IBC Airlines lanzará el lunes 10 de noviembre...",WEB rezonodwes.com,-16.431229,-63.108212,20KMG8844783360,10 de noviembre,Santa Cruz,Provincia Ñuflo de Chávez,village,cache,2025-11-06T17:56:57,2025-11-06T17:56:57
900,haiti,Sin clasificar,Cong: Nancy Pelosi anuncia que se jubilará en enero 2027 - Rezo Nòdwès https://renononodwes.com/?p=368887 Estados Unidos • Congreso: Nancy Pelosi anuncia que se jubilará en enero de 2027 L.,WEB rezonodwes.com,,,,enero 2027 - Rezo Nòdwès https://renononodwes,,,,mensajes,2025-11-06T18:27:20,2025-11-06T18:27:20
901,haiti,Sin clasificar,Quebec prevé acoger a 45.000 inmigrantes permanentes al año entre 2026 y 2029 - Rezo Nòdwès https://renonododwes.com/?p=368891 Quebec prevé acoger a 45.000 inmigrantes permanentes al año entre 2026 y 2029 Quebec prevé acoger a 45 000 inmigrantes permanentes al año entre 2026 y 2029 Quebec reducirá sus umbrales de inmigración y abol el PEQ El Gobierno Legault prevé acoger a 45.000 inmigrantes pe...,WEB rezonodwes.com,52.476089,-71.825867,19UCU0808717747,Quebec,Québec,,administrative,cache,2025-11-06T18:36:50,2025-11-06T18:36:50
902,haiti,Sin clasificar,"En el artículo 24 2) de la Constitución de 1987, no es más que un recuerdo administrativo.",WEB rezonodwes.com,23.991025,-104.673089,13QEG3325253271,artículo 24 2) de la Constitución de 1987,Durango,Municipio de Durango,residential,cache,2025-11-06T19:07:35,2025-11-06T19:07:35
903,haiti,Sin clasificar,"Travaux de réhabilitation : la rue Faustin 1er temporairement fermée à la circulation du 1er au 9 novembre, annonce la Mairie de Port-au-Prince et le MTPTC - Juno7 https://www.juno7.ht/travaux-de-rehabilitation-la-rue-faustin-1er-mtptc/ Un citoyen a rendu un sac contenant 16 000 euros Allemagne : un véhicule fonce dans la foule à Münster, plusieurs morts et de nombreux blessés Angela Merkel off...",WEB www.juno7.ht,,,,Travaux de réhabilitation,,,,mensajes,2025-11-06T19:08:31,2025-11-06T19:08:31
904,haiti,Sin clasificar,Muerte de un empleado del CNE: Legale solicita justicia y denuncia la impunidad https://www.tripfoumi.com/blog/2025/11/06/muerte-dun-employe-du-cne-lopc-solicité-justice-et-denonce-limpunite/,@HaitiNewsExpress,,,,Muerte de un empleado del CNE,,,,mensajes,2025-11-06T19:10:15,2025-11-06T19:10:15
905,haiti,Sin clasificar,"El proyecto de decreto electoral en circulación poco antes del final previsto de una transición incierta Haití está difundiendo un proyecto de decreto electoral, mientras que la transición está llegando a su fin, entre incertidumbres políticas, desafíos de seguridad y presiones internacionales.",WEB www.alterpresse.org,,,,circulación poco antes del final previsto de una transición incierta Haití,,,,mensajes,2025-11-06T19:23:25,2025-11-06T19:23:25
906,haiti,Criminalidad,"#AssassanatJovenelMoisse https://www.alterpressse.org/spip.php?secec61 Haití • 4 años después del asesinato de Jovenel Moisse: Un ex asesor aboga por tres investigaciones y un asalto de las elites Cuatro años después del asesinato del presidente Jovenel Moisse, antiguo consesese consesejera Guichard Doré pide tres investigaciones complementarias • judicial, (...) Haití, una misa de requiem en e...",WEB www.alterpresse.org,,,,AssassanatJovenelMoisse,,,,mensajes,2025-11-06T19:23:27,2025-11-06T19:23:27
907,haiti,Sin clasificar,"A través de Haiti https://www.alterpressse.org/spip.php? secc52 Cyclo Melissa: Peti Goave muy golpeada, las autoridades locales denuncian la falta de prevención En Peti Goâve, el ciclón Melissa ha causado decenas de muertos y graves daños.",WEB www.alterpresse.org,,,,Peti Goâve,,,,mensajes,2025-11-06T19:23:29,2025-11-06T19:23:29
908,haiti,Sin clasificar,"AlterForo https://www.alterpressse.org/spip.php?srie42 Michel Legross cuestiona la sinceridad de una solución haitiana de la crisis, a menudo dictada por el extranjero e imposante ante la inseguridad (...) Haití ante los desafíos de la estabilidad y de la seguridad (...) Haití ante los desafíos de la estabilidad y de la seguridad (...): Legros cuestiona la sinceridad de una solución haitiana de...",WEB www.alterpresse.org,,,,Haití ante los desafíos de la estabilidad y de la seguridad (...,,,,mensajes,2025-11-06T19:23:30,2025-11-06T19:23:30
909,haiti,Sin clasificar,"El 5 de noviembre de 2025, ante el Consejo Permanente de la Organización de los Estados American (Oea), ante el Consejo Permanente de la Organización de los Estados American (Oea), el Secretario General Albert Ramdin denunció una (...) 24 millones de dólares de ayuda de los Estados Unidos para Haití y el Caribe después del paso devastador de Mélissa Los Estados Unidos anuncian una ayuda humanit...",WEB www.alterpresse.org,,,,Consejo Permanente de la Organización de los Estados American (Oea,,,,mensajes,2025-11-06T19:23:31,2025-11-06T19:23:31
910,haiti,Sin clasificar,RDHINEWS https://www.rhinews.com/ Haití Uuragan Melissa: el RNDDH denuncia la falta de adecuación de las medidas del Estado frente a un balance humano y material catas...,WEB www.rhinews.com,,,,Haití Uuragan Melissa,,,,mensajes,2025-11-06T19:23:36,2025-11-06T19:23:36
911,haiti,Sin clasificar,"CONTACTAR NOSOTROS https://www.rhinews.com/contact/ Para sus preguntas, comentarios y sugerencias, no dude en ponerse en contacto con nosotros. Suscríbete gratis a la información de RHI Suscríbete gratuitamente a la información de RHI",WEB www.rhinews.com,,,,ponerse en contacto con nosotros,,,,mensajes,2025-11-06T19:23:36,2025-11-06T19:23:36
912,haiti,Sin clasificar,SE CONNECTER https://www.rhinews.com/se-conectar/ Suscríbete gratis a la infocarta de RHI Suscríbete gratis a la infocarta de RHI,WEB www.rhinews.com,41.792341,-76.451167,18TUM7942627738,Se Connecter,Pennsylvania,Bradford County,footway,cache,2025-11-06T19:23:37,2025-11-06T19:23:37
913,haiti,Sin clasificar,El RNDDH denuncia la falta de adecuación de las medidas del Estado ante un balance humano y material catas https://www.rhinews.com/category/actuales/actuales/ Haití Ouragan Mélissa: el RNDDH denuncia la falta de adecuación de las medidas del Estado frente a un balance humano y material catas...,WEB www.rhinews.com,,,,Rnddh,,,,mensajes,2025-11-06T19:23:39,2025-11-06T19:23:39
914,haiti,Sin clasificar,¿Cómo el abandono de las elites ha desviado el ideal de independencia -y cómo reconquicerlo...? Cómo el abandono abandono de las elites ha desviado el ideal de independencia - y cómo reconquis...,WEB www.rhinews.com,45.939476,9.149410,32TNR1158187333,Cómo,Lombardia,Como,administrative,cache,2025-11-06T19:23:40,2025-11-06T19:23:40
915,haiti,Sin clasificar,"Noticias de Haití https://haitiantimes.com/es/Noticias-de-Hait%C3%AD/ Regístrate para The Haitian Times Resumen diario de noticias Manténgase al tanto de las últimas noticias de Haití y la diáspora, enviadas directamente a su bandeja de entrada.",WEB haitiantimes.com,19.139995,-72.357097,18QYG7800918421,Haití,,,administrative,cache,2025-11-06T19:29:24,2025-11-06T19:29:24
916,haiti,Sin clasificar,"Apoya nuestra misión de contar nuestra propia narrativa https://haitiantimes.com/es/donar/ Apoya nuestra misión de contar nuestra propia narrativa Durante años 25, The Haitian Times Ha reportado las historias que dan forma a la experiencia haitiana, desde las calles de Puerto Príncipe hasta los barrios de Brooklyn, desde los tribunales de inmigración hasta las celebraciones comunitarias.",WEB haitiantimes.com,,,,Apoya,,,,mensajes,2025-11-06T19:29:24,2025-11-06T19:29:24
917,haiti,Sin clasificar,Inmigración y Migración https://haitiantimes.com/es/noticias-de-inmigraci%C3%B3n/ Manténgase actualizado sobre las últimas noticias sobre inmigración y migración que afectan a los haitianos en todo el mundo.,WEB haitiantimes.com,37.441031,-122.237896,10SEG6741544071,todo el mundo,California,San Mateo County,residential,cache,2025-11-06T19:29:25,2025-11-06T19:29:25
918,haiti,Sin clasificar,"New York https://haitiantimes.com/es/Nueva-York/ Regístrate para The Haitian Times Resumen diario de noticias Manténgase al tanto de las últimas noticias de Haití y la diáspora, enviadas directamente a su bandeja de entrada.",WEB haitiantimes.com,40.712728,-74.006015,18TWL8395807342,New York,New York,City of New York,administrative,cache,2025-11-06T19:29:25,2025-11-06T19:29:25
919,haiti,Sin clasificar,"Florida https://haitiantimes.com/es/noticias-de-florida/ Regístrate para The Haitian Times Resumen diario de noticias Manténgase al tanto de las últimas noticias de Haití y la diáspora, enviadas directamente a su bandeja de entrada.",WEB haitiantimes.com,27.756767,-81.463983,17RML5427770344,Florida,Florida,,administrative,cache,2025-11-06T19:29:26,2025-11-06T19:29:26
920,haiti,Sin clasificar,"Archivos de Puerto Príncipe https://haitiantimes.com/es/categor%C3%ADa/Hait%C3%AD/Puerto-Pr%C3%ADncipe/ Regístrate para The Haitian Times Resumen diario de noticias Manténgase al tanto de las últimas noticias de Haití y la diáspora, enviadas directamente a su bandeja de entrada.",WEB haitiantimes.com,38.892737,-77.022920,18SUJ2455906818,Archivos,District of Columbia,Washington,museum,cache,2025-11-06T19:33:30,2025-11-06T19:33:30
921,haiti,Sin clasificar,"Archivos de Cap-Haitien https://haitiantimes.com/es/categor%C3%ADa/Hait%C3%AD/gorra-hatien/ Regístrate para The Haitian Times Resumen diario de noticias Manténgase al tanto de las últimas noticias de Haití y la diáspora, enviadas directamente a su bandeja de entrada.",WEB haitiantimes.com,38.892737,-77.022920,18SUJ2455906818,Archivos,District of Columbia,Washington,museum,cache,2025-11-06T19:33:32,2025-11-06T19:33:32
922,haiti,Sin clasificar,"Archivos de Gonaives https://haitiantimes.com/es/categor%C3%ADa/Hait%C3%AD/gon%C3%A1ives/ Regístrate para The Haitian Times Resumen diario de noticias Manténgase al tanto de las últimas noticias de Haití y la diáspora, enviadas directamente a su bandeja de entrada.",WEB haitiantimes.com,38.892737,-77.022920,18SUJ2455906818,Archivos,District of Columbia,Washington,museum,cache,2025-11-06T19:33:39,2025-11-06T19:33:39
923,haiti,Sin clasificar,"Archivos de Port-de-Paix https://haitiantimes.com/es/categor%C3%ADa/Hait%C3%AD/puerto-de-paz/ Regístrate para The Haitian Times Resumen diario de noticias Manténgase al tanto de las últimas noticias de Haití y la diáspora, enviadas directamente a su bandeja de entrada.",WEB haitiantimes.com,38.892737,-77.022920,18SUJ2455906818,Archivos,District of Columbia,Washington,museum,cache,2025-11-06T19:33:41,2025-11-06T19:33:41
924,haiti,Sin clasificar,"Archivos de Juana Méndez https://haitiantimes.com/es/categor%C3%ADa/Hait%C3%AD/Juana-M%C3%A9ndez/ Regístrate para The Haitian Times Resumen diario de noticias Manténgase al tanto de las últimas noticias de Haití y la diáspora, enviadas directamente a su bandeja de entrada.",WEB haitiantimes.com,38.892737,-77.022920,18SUJ2455906818,Archivos,District of Columbia,Washington,museum,cache,2025-11-06T19:33:46,2025-11-06T19:33:46
925,haiti,Sin clasificar,"Archivos de Jacmel https://haitiantimes.com/es/categor%C3%ADa/Hait%C3%AD/jacmel/ Regístrate para The Haitian Times Resumen diario de noticias Manténgase al tanto de las últimas noticias de Haití y la diáspora, enviadas directamente a su bandeja de entrada.",WEB haitiantimes.com,38.892737,-77.022920,18SUJ2455906818,Archivos,District of Columbia,Washington,museum,cache,2025-11-06T19:33:50,2025-11-06T19:33:50
926,haiti,Sin clasificar,El Partido Fu fusión juzga a la Unión Europea como una contribución de 3 mil millones de gourdos para el fortalecimiento de los partidos políticos...,WEB www.rhinews.com,43.671159,5.872230,31TGJ3155139359,Partido Fu,Provence-Alpes-Côte d'Azur,Var,locality,cache,2025-11-06T19:58:13,2025-11-06T19:58:13
927,haiti,Sin clasificar,"🇭🇹🩺 ALODÒK se yon platfòm ki mete an kontak pwofesyonèl sante tankou medsen, enfimyè, saj-fam, sikològ ak pasyan.",@haitianaute,,,,Avèk ALODÒK,,,,mensajes,2025-11-06T21:48:15,2025-11-06T21:48:15
928,haiti,Sin clasificar,Safe Airspace - Conflict Zone & Risk Database https://safeairspace.net/congo-drc/ para recibir advertencias de Zona de Conflicto y Riesgo.,WEB safeairspace.net,,,,Safe Airspace,,,,mensajes,2025-11-06T22:18:38,2025-11-06T22:18:38
929,haiti,Sin clasificar,"- Rezo Nòdwès https://renononodowes.com/?p=368895 Jefe de Estado más de edad en el mundo, Paul Biya, de 92 años, prestó juramento por un octavo mandato en Camerún - Rezo Nòdwès https://renononododwes.com/?p=368895 Jefe de Estado más de edad en el mundo, Paul Biya, de 92 años, prestó juramento por un octavo mandato en Camerún El Presidente del Camerún, Paul Biya, decano de los Jefes de Estado en...",WEB rezonodwes.com,33.273647,-115.569155,11SPS3325482537,mundo,California,Imperial County,locality,cache,2025-11-07T00:26:33,2025-11-07T00:26:33
930,haiti,Sin clasificar,"Midwest https://haitiantimes.com/es/Medio-Oeste/ Regístrate para The Haitian Times Resumen diario de noticias Manténgase al tanto de las últimas noticias de Haití y la diáspora, enviadas directamente a su bandeja de entrada.",WEB haitiantimes.com,43.411391,-106.280075,13TCJ9636107296,Midwest,Wyoming,Natrona County,administrative,cache,2025-11-07T00:27:31,2025-11-07T00:27:31
931,haiti,Sin clasificar,"Diáspora haitiana https://haitiantimes.com/es/Noticias-sobre-la-di%C3%A1spora-haitiana/ Regístrate para The Haitian Times Resumen diario de noticias Manténgase al tanto de las últimas noticias de Haití y la diáspora, enviadas directamente a su bandeja de entrada.",WEB haitiantimes.com,19.711662,-101.217309,14QKG6759381091,Diáspora,Michoacán,Morelia,footway,cache,2025-11-07T00:27:31,2025-11-07T00:27:31
932,haiti,Sin clasificar,La Unión Europea presta apoyo a las víctimas del hurac hurac hurac hu hu hu hu hu hu hu hu Melissa con 1 millón de euros y nuevas entregas por vía aérea - Rezo Nòdwès https://renononododwes.com/?p=368897 La Unión Europea presta apoyo a las víctimas del hu hu hu hu hu hu hu hu hu hu Melissa con 1 millón de euros y nuevas entregas por vía aérea En respuesta a la situación humanitaria en Haití a r...,WEB rezonodwes.com,,,,respuesta a la situación humanitaria en Haití a r,,,,mensajes,2025-11-07T00:56:42,2025-11-07T00:56:42
933,haiti,Sin clasificar,https://youtu.be/2XapLQC0kMg?si=-v9pz3aZJqiMVP0X,@machannzen,,,,XapLQC0kMg,,,,mensajes,2025-11-07T01:04:15,2025-11-07T01:04:15
934,haiti,Sin clasificar,"- Rezo Nòdwèdwès https://renonodwès https://renonododwes.com/?p=368899 ¡¿?p=368899 I have four words for you larr Zohran Mamdani sloven toma en Trump después de su victoria en el ayuntamiento de Nueva York Nueva York, 5 de noviembre de 2025 (RezoN'dwès) - Rezo N'dwès https://renonodwes.com/?p=368899 ¡¡¿?p=368899 larvo I have four words for you larrran Zohran Mamdani sloven toma en Trump después...",WEB rezonodwes.com,,,,Trump después de su victoria,,,,mensajes,2025-11-07T02:36:27,2025-11-07T02:36:27
935,haiti,Sin clasificar,Encontrará su puesto de portavoz de la Policía Nacional de Haití - Rezo Nòdwès https://renononodowes.com/?p=368903 Garry Desrosiers encuentra su puesto de portavoz de la Policía Nacional de Haití - Rezo Nòdwès https://renonononododwes.com/?p=368903 Garry Desrosiers encuentra su puesto de portavoz de la Policía Nacional de Haití - Rezo Nòdwès https://rezononododwes.com/?p=368903 Garry Desrrosier...,WEB rezonodwes.com,,,,Encontrará su puesto de portavoz de la Policía Nacional de Haití,,,,mensajes,2025-11-07T02:46:28,2025-11-07T02:46:28
936,haiti,Sin clasificar,"Brésil | Ouverture du « Leaders’ Summit » de la COP30 à Belém : les chefs d’État mobilisés, mais sans Washington - Rezo Nòdwès https://rezonodwes.com/?p=368906 Brésil | Ouverture du « Leaders’ Summit » de la COP30 à Belém : les chefs d’État mobilisés, mais sans Washington Le sommet des chefs d’État et de gouvernement de la COP30 s’est ouvert le 6 novembre 2025 à Belém, au Brésil.",WEB rezonodwes.com,-10.333333,-53.200000,22LBP5908356902,Brésil,,,administrative,cache,2025-11-07T02:56:20,2025-11-07T02:56:20
937,haiti,Sin clasificar,Ouragan Mélissa: el RNDDH denuncia la responsabilidad del Estado ante la tragedia - Rezo Nòdwès https://renononododwes.com/?p=368909 Ouragan Mélissa: el RNDDH denuncia la responsabilidad del Estado ante la tragedia - Rezo Nòdwès https://renononododwes.com/?p=368909 Ouragan Mélissa: el RNDDH denuncia la responsabilidad del Estado ante la tragedia - Rezo Nòdwwèdwès - Rezo Nòdwès https://rezonodon...,WEB rezonodwes.com,,,,Ouragan Mélissa,,,,mensajes,2025-11-07T03:06:27,2025-11-07T03:06:27
938,haiti,Sin clasificar,"El bipic* sobre Michael Jacks se desvela por fin, salida prevista en abril 2026 - Rezo Nòdwès https://renononododwes.com/?p=368912 Cinéma se desvela el bipic* sobre Michael Jacks se revela por fin, salida prevista en abril 2026 Universal desvela el primer teaser del bipic Michael dedicado a Michael Jacks Paris, 6 de noviembre de 2025 - Rezo Nòdwès https://renonododwes.com/?p=368912 Cine",WEB rezonodwes.com,,,,abril 2026 - Rezo Nòdwès https://renononododwes,,,,mensajes,2025-11-07T03:26:27,2025-11-07T03:26:27
939,haiti,Sin clasificar,"- Rezo Nòdwès https://renononododwes https://renononodwes.com/?p=368914 Haití: la aduana predica la virtud, pero el país sanga bajo las balas Análisis la ciudad de Puerto Príncipe, 6 de noviembre de 2025 L-Administración General de Aduanas (AGD) eligió su batalla: la de la moralidad.",WEB rezonodwes.com,,,,L-Administración General de Aduanas (AGD,,,,mensajes,2025-11-07T03:46:35,2025-11-07T03:46:35
940,haiti,Sin clasificar,El PMA ya ha prestado asistencia de emergencia a cerca de 13.000 personas y prevé distribuir raciones de raciones de alimentos a otros 200.000 de la producción destru a más de un 90% de la producción de algunas zonas.,WEB rezonodwes.com,,,,Haïti s’est gravement détériorée,,,,mensajes,2025-11-07T04:06:36,2025-11-07T04:06:36
941,haiti,Sin clasificar,"A partir del 17 de noviembre - Rezo Nòdwès https://renonododwes.com/?p=368919 Sunrise Airways abre dos nuevos enlaces a Jacmel y Jérémie a partir del 17 de noviembre Alcanzar la Ciudad de la Independencia, sigue siendo un gran riesgo: las bandas firmemente instaladas en la Nacional 1 siguen escapando, desde 2021, al control total de la policía.",WEB rezonodwes.com,,,,Nacional 1 siguen escapando,,,,mensajes,2025-11-07T05:26:12,2025-11-07T05:26:12
942,libia,Sin clasificar,"Buenos días, Cero, aquí están las temperaturas previstas para el jueves en algunas ciudades y regiones libias de Benghazi, Trípoli.",@sefr0ly,,,,algunas ciudades y regiones libias de Benghazi,,,,mensajes,2025-11-06T08:10:53,2025-11-06T08:10:53
943,libia,Sin clasificar,Fotografías de miles de jóvenes de toda Libia reunidos en el desierto de Wadan en Raleigh T.,@sefr0ly,,,,desierto de Wadan en Raleigh T,,,,mensajes,2025-11-06T09:10:53,2025-11-06T09:10:53
944,libia,Sin clasificar,"Según la actualización del Centro Meteorológico, con la posibilidad de que sigan lloviendo en algunas zonas del norte, en particular entre Misrata y el Golfo, así como en las regiones nororientales.",@gplusss,,,,algunas zonas del norte,,,,mensajes,2025-11-06T09:21:53,2025-11-06T09:21:53
945,libia,Sin clasificar,"La ruta internacional Sirte-Sukina-Sabha, diario de la dirección libia -- noticias libias 2025-11-05 https://www.addreslibybaa.com/2025/%d8%7%d9%d9%d9%d9%d9%d9%d8%d8%d8%d8%d9%d9%d9%d8%d%d9%d%d9%d9%d9%d8%d8%d8%d9%d9%d9%d9%d9%d%d9%d8%d8%d8%d8%d8%d8%d8%d8%d8%d8%d%d8%d%d%d8%d%d%d8%d%d%d.",WEB www.addresslibya.com,,,,Sirte-Sukina-Sabha,,,,mensajes,2025-11-06T09:24:54,2025-11-06T09:24:54
946,libia,Sin clasificar,El equipo de urgencias y atención psicológica de emergencia presuntamente trasladó a seis de los desplazados que se encontraban en la granja de Akrik al Centro de Salud Mental para su evaluación y tratamiento.,@gplusss,,,,granja de Akrik al Centro de Salud Mental para su evaluación y tratamiento,,,,mensajes,2025-11-06T09:27:20,2025-11-06T09:27:20
947,libia,Criminalidad,"En su informe de octubre de 2025, la organización de vigilancia de la delincuencia en Libia documenta la persistencia de graves violaciones contra civiles en todo el país, cometidas por órganos de seguridad y grupos armados de las autoridades en el este y el oeste del país.",@libyapress,,,,su informe de octubre de 2025,,,,mensajes,2025-11-06T09:31:53,2025-11-06T09:31:53
948,libia,Sin clasificar,"El Centro Meteorológico Nacional prevé una temperatura moderada en la mayoría de las regiones del país, que oscila entre 20 y 26 m en las regiones del norte, mientras que las nubes y las posibilidades de lluvia siguen aumentando en las regiones de #Norte-Este, mientras que las temperaturas oscilan entre 25 m y 31 m en las regiones del sur sin un cambio climático notable.",@sefr0ly,,,,mayoría de las regiones del país,,,,mensajes,2025-11-06T09:40:53,2025-11-06T09:40:53
949,libia,Sin clasificar,"Los gitanos han dejado claro que el gasto no reconocido del gobierno paralelo ha causado dificultades de vida, precios elevados y escasez de liquidez, lo que ha puesto en peligro la quiebra del país. Los gitanos han preguntado: “¿Qué paga el ciudadano por 1.000 dinares y recibe sólo 800? ¿Cómo pierde el 20% en cada transferencia?",@gplusss,,,,peligro la quiebra del país,,,,mensajes,2025-11-06T09:44:53,2025-11-06T09:44:53
950,libia,Criminalidad,– Fuentes gubernamentales indican que esta fue una de las razones que llevaron al Gobierno de Italia a no entregar a Osama Ngem a la delincuencia internacional y a expulsarlo de inmediato a Libia.,@libyapress,42.638426,12.674297,33TUH0932323285,Italia,,,administrative,nominatim,2025-11-06T09:47:53,2025-11-06T09:47:53
951,libia,Sin clasificar,"Wadan, los preparativos finales para la ceremonia de inauguración de Raleigh T-T-T-T-Sharaui.",@almasartvlibya,20.933726,-11.617374,29QKD2778817035,Wadan,Adrar أدرار,Ouadane وادان,city,nominatim,2025-11-06T10:14:08,2025-11-06T10:14:08
952,libia,Sin clasificar,"Los emplazamientos indicaron que el avión militar estadounidense Dornier C-146A, con el número de matrícula 97-3091, había salido ayer, 5 de noviembre, del sur de Libia. Los emplazamientos indicaron que el avión pertenecía a la Fuerza Aérea de los Estados Unidos y se dirigía a la base militar de Khanya, situada en la isla griega de Creta.",@gplusss,,,,isla griega de Creta,,,,mensajes,2025-11-06T10:14:08,2025-11-06T10:14:08
953,libia,Sin clasificar,"En su calidad de Comandante en Jefe del ""Ejército Libio"", el exiliado ha tomado la decisión de formar una brigada de infantería automática denominada ""Batallón 218 de infantería automática"", bajo la dirección del Estado Mayor del Ejército de Libia Occidental. - El exiliado ordenó a Mohamed al-Haddad que nombrara a un comandante de la brigada y a sus batallones y determinara su posición.",@libyapress,,,,"su calidad de Comandante en Jefe del ""Ejército Libio",,,,mensajes,2025-11-06T10:14:08,2025-11-06T10:14:08
954,libia,Sin clasificar,El boxeador nacional Ahmad Al-Kum está ganando una victoria digna de su homólogo sueco Oliver Pearson en el Campeonato Internacional de Boxeo de Bosnia 2025.,@sefr0ly,,,,Campeonato Internacional de Boxeo de Bosnia 2025,,,,mensajes,2025-11-06T10:14:08,2025-11-06T10:14:08
955,libia,Sin clasificar,"El sitio de inteligencia francés Afrika Intelligence: ex Director de Comercialización de la Corporación Nacional del Petróleo, Imad Bin Rajab, condenado en 2023 en un caso de corrupción, vuelve y trata de crear una controvertida filial en la empresa de servicios petroleros mediterráneos de ""Monaco"".",@libyapress,,,,un caso de corrupción,,,,mensajes,2025-11-06T10:29:29,2025-11-06T10:29:29
