fecha,hora,pais,categoria_sicu,descripcion,localizacion,lat,lon,fuente
2025-11-30,16:47:58,Gaza,Otros,:: Oficina del Presidente de Israel: Netanyahu presentó una solicitud de indulto y la transmitió a la Sección de Asuntos Jurídicos,,,,@AjaNews
2025-11-30,16:47:58,Gaza,Otros,"Netanyaho: La investigación de mi caso comenzó hace 10 años, y mis juicios comenzaron hace 6 años, y pueden durar muchos años.",,,,@AjaNews
2025-11-30,16:47:58,Gaza,Otros,"Lo mejor para mí fue continuar el proceso judicial para obtener mi inocencia, pero los intereses políticos y de seguridad requieren otra cosa.",,,,@AjaNews
2025-11-30,16:47:58,Gaza,Otros,"Urgentemente, Netanyahu: Mi juicio sigue generando desacuerdos y estoy convencido de que su conclusión reducirá las diferencias y logrará una reconciliación amplia.",,,,@AjaNews
2025-11-30,16:47:58,Gaza,Otros,Urgentemente Netanyahu: Trump pide que se ponga fin de inmediato a mi juicio para poder avanzar hacia los intereses comunes e importantes de Israel y los Estados Unidos,,,,@AjaNews
2025-11-30,16:47:58,Gaza,Otros,No puedes perdonar a Netanyahu antes de que se declare culpable y se retire de la vida política.,,,,@AjaNews
2025-11-30,16:47:58,Gaza,Otros,El Ministro de Relaciones Exteriores del Irán debe poner fin a los ataques israelíes contra el Líbano y Siria,,,,@AjaNews
2025-11-30,16:47:58,Gaza,Otros,El Ministro de Relaciones Exteriores de Turquía: La comunidad internacional debe cumplir con su deber de poner fin a los ataques israelíes contra Siria,,,,@AjaNews
2025-11-30,16:47:58,Gaza,Otros,• El Ministro de Relaciones Exteriores de Turquía: apoyamos todos los esfuerzos internacionales para poner fin a la guerra en Ucrania y esperamos que se inicien negociaciones serias,,,,@AjaNews
2025-11-30,16:47:58,Gaza,Otros,Extremo exterior ruso: los ataques de Ucrania en el Mar Negro están relacionados con intentos de obstaculizar los esfuerzos internacionales por llegar a un arreglo,,,,@AjaNews
2025-11-30,16:47:58,Gaza,Otros,• Organismo de Gestión de Desastres de Indonesia: aumento del número de víctimas de inundaciones a 442,,,,@AjaNews
2025-11-30,16:47:58,Gaza,Otros,"• El portavoz de Hamas, Hazem Kassem, de la isla: la búsqueda continua de los cadáveres de los prisioneros, a pesar de las dificultades, refleja nuestro pleno compromiso con el Acuerdo",,,,@AjaNews
2025-11-30,16:47:58,Gaza,Otros,"El portavoz de Hamas, Hazem Kassem, de la isla: la ocupación está retrasando la entrada en la segunda etapa del acuerdo de cesación de la guerra y sus derechos",,,,@AjaNews
2025-11-30,16:47:58,Gaza,Otros,Hazem Qassim de la isla: Pedimos a los mediadores que presionen a la ocupación para que cumpla sus compromisos y abra el cruce de Rafah y la transición a la segunda fase.,Rafah,31.291,34.245,@AjaNews
2025-11-30,16:47:58,Gaza,Otros,□ Axio de fuentes: Se espera que Steve Whitcoff y Jared Kouchner presenten el plan de paz enmendado a Putin el martes,,,,@AjaNews
2025-11-30,16:47:58,Gaza,Otros,Jefe de la delegación negociadora de Ucrania: Tenemos instrucciones del Presidente Zelensky de proteger nuestros intereses y avanzar sobre la base de los resultados de Ginebra,,,,@AjaNews
2025-11-30,16:47:58,Gaza,Conflicto Armado,"Fuente militar sudanesa de la isla: El ejército avanza hacia el oeste de la ciudad de Abasiya, en el estado de Kordofán del Sur y controla varias ciudades.",,,,@AjaNews
2025-11-30,16:47:58,Gaza,Otros,El Ministro de Relaciones Exteriores de Israel: la conclusión del juicio de Netanyahu refleja el interés del Estado y contribuirá a la unidad de Israel,,,,@AjaNews
2025-11-30,16:47:58,Gaza,Otros,- El Ministro de Relaciones Exteriores del Irán: no hay negociaciones con las partes europeas y estamos evaluando el clima para determinar la posibilidad de negociar.,,,,@AjaNews
2025-11-30,16:47:58,Gaza,Otros,"El Ministro de Relaciones Exteriores de la República Islámica del Irán: No dudaremos en negociar con ninguna de las partes si garantiza los derechos de nuestro pueblo, pero no aceptaremos las políticas de dictado.",,,,@AjaNews
2025-11-30,16:47:58,Gaza,Conflicto Armado,"• Corresponsal de la isla: estallido de enfrentamientos tras la incursión de las fuerzas de ocupación en la ciudad de Asgarba, al sur de Naplusa, al norte de la Ribera Occidental",,,,@AjaNews
2025-11-30,16:47:58,Gaza,Otros,• Pruebas urgentes: dispuestos a colaborar con las Naciones Unidas y sus organismos para alcanzar los objetivos en todas las esferas de la acción humanitaria y de otro tipo,,,,@AjaNews
2025-11-30,16:49:20,Gaza,Otros,"El Ministerio de Salud de Palestina, en el Día Mundial de la Salud, la Franja de Gaza, sin medicamentos ni condiciones catastróficas en el Día Mundial de la Salud, la Franja de Gaza, sin medicamentos y sin condiciones catastróficas, la Franja de Gaza, el Subsecretario de Salud, Dr. Youssef Abu Al-Rish, se reúne con la Coordinadora de Asuntos Humanitarios interina, Sra.",Gaza City,31.520,34.450,WEB https://www.moh.gov.ps/portal/en/
2025-11-30,16:49:21,Gaza,Otros,"Gaza No 17549 viendo... el miércoles 27 de diciembre, 2023.",Gaza City,31.520,34.450,WEB https://www.gazaalan.net/
2025-11-30,16:49:21,Gaza,Otros,Los miembros de la Autoridad están llevando a cabo una reunión oficial en la que se confirma la firmeza de la cooperación entre la fiscalía palestina y su homólogo jordano. ¿Los esfuerzos israelíes por anexar la Ribera Occidental en 2025 tienen éxito?,Gaza City,31.520,34.450,WEB https://www.alquds.com/ar/home
2025-11-30,16:49:23,Gaza,Otros,"La agencia de noticias Shahab, Palestina News, ha participado en la lista de correo para darle las últimas noticias y todo lo nuevo.",,,,WEB https://shehabnews.com/
2025-11-30,16:49:24,Gaza,Otros,Únete a la lista de correo para llegar a las últimas noticias y todo lo nuevo.,,,,WEB https://shehabnews.com/post/category/35/EN
2025-11-30,16:49:24,Gaza,Otros,"La agencia de noticias Shahab, Palestina News, ha participado en la lista de correo para darle las últimas noticias y todo lo nuevo.",,,,WEB https://shehabnews.com/breaking-news#summary
2025-11-30,16:49:30,Gaza,Disturbios Civiles,"Un acuerdo financiero que suspende la huelga general de maestros en las escuelas de la Ribera Occidental, de conformidad con el plan Trump, tropieza con obstáculos. El Ministerio de Educación y el Ministerio de Educación Superior, el Ministerio de Finanzas y la Federación General de Maestros anunciaron la suspensión de la huelga.",Gaza City,31.520,34.450,WEB https://www.alaraby.co.uk/news/palestine
2025-11-30,16:51:52,Gaza,Otros,Los niños recién nacidos de Gaza corren el riesgo de morir con la primera ola de frío real,Gaza City,31.520,34.450,@GazaNewsNow
2025-11-30,16:51:52,Gaza,Otros,"Celebrar el Día de la Evacuación Yemení, un Diluvio Humano en Yemen, apoyar la opción de la resistencia y apoyar a los pueblos palestino, libanés y sirio, y condenar la permisividad de la ocupación israelí de la nación.",,,,@GazaNewsNow
2025-11-30,16:51:52,Gaza,Otros,"Las fuerzas de ocupación atacan la rotonda de Frosty, al este de Naplusa, desde Alon Morey.",,,,@GazaNewsNow
2025-11-30,16:51:52,Gaza,Otros,"Levi, el hebreo: en respuesta a la petición de indulto de Netanyahu: ""La persona no tiene que ser culpable antes de pedir perdón.",,,,@GazaNewsNow
2025-11-30,16:51:52,Gaza,Otros,":: Violación y tortura sexual de un periodista palestino en el Centro de Protección de Periodistas Palestinos PJPC: un periodista palestino detenido por las autoridades israelíes fue víctima, después del 7 de octubre, de un delito de violación y de tortura sexual por un perro entrenado, lo que le causó un grave trauma psicológico que perdió el equilibrio mental durante más de dos meses en uno de los delitos más graves documentados contra periodistas en las cárceles israelíes. El delito ocurrió en el interior del centro de detención de Siddeh Timan, después de que el periodista fuera llevado...",,,,@GazaNewsNow
2025-11-30,16:51:52,Gaza,Otros,- Los colonos expulsan a los pastores y les niegan el acceso a las tierras de pastoreo en la comunidad beduina de Hatura al este de la Jerusalén ocupada,,,,@GazaNewsNow
2025-11-30,16:51:52,Gaza,Otros,"• Sitio de noticias de última hora en hebreo: entre los muertos de esta mañana en Rafah, Abdullah Hamad, hijo de la oficina política de Hamas Ghazi Hamad",Rafah,31.291,34.245,@GazaNewsNow
2025-11-30,16:51:52,Gaza,Otros,"La voz del pueblo árabe contra el ocupante israelí ""No los abandones"" es la clave de la respuesta de la población a las fuerzas de ocupación.",,,,@GazaNewsNow
2025-11-30,16:51:52,Gaza,Conflicto Armado,"□ La página de Yannon está disponible en hebreo: el casco del comandante de la unidad de comunicaciones y reconocimiento de la 55a brigada sobrevivió al tiroteo en Beit Jin, en el sur de Siria",,,,@GazaNewsNow
2025-11-30,16:51:52,Gaza,Otros,"**La artillería de ocupación dispara bengalas sobre el valle de Shar ' a, en las afueras de Beit Leif, en el Líbano meridional. **",,,,@GazaNewsNow
2025-11-30,16:51:52,Gaza,Conflicto Armado,"El estallido de enfrentamientos entre los jóvenes y las fuerzas de ocupación en la ciudad de Askarba, al sudeste de Naplusa.",,,,@GazaNewsNow
2025-11-30,16:51:52,Gaza,Otros,- Los mecanismos de ocupación atacan la ciudad de Naplusa desde la barrera de Al-Tur,,,,@GazaNewsNow
2025-11-30,16:51:52,Gaza,Otros,"Los colonos están destruyendo un vehículo cerca del puesto de control de Za'tara, al sur de Naplusa.",,,,@GazaNewsNow
2025-11-30,16:51:52,Gaza,Otros,El que siga el juicio de Netanyahu verá que los hilos de la causa se derrumban y será perdonado por el pueblo de Israel.,,,,@AjaNews
2025-11-30,16:51:52,Gaza,Otros,Beni Gants: Netanyahu sabe que una solicitud de amnistía que no se ajusta a los procedimientos de Israel es totalmente falsa,,,,@AjaNews
2025-11-30,16:51:52,Gaza,Otros,"El líder del Partido de Israel en nuestra casa: lo que Netanyahu hizo no es una petición de perdón, sino una extorsión con amenazas.",,,,@AjaNews
2025-11-30,16:51:53,Gaza,Otros,"Aviones de ocupación dispararon al este de Jabaliya, al norte de la Franja de Gaza.",Gaza City,31.520,34.450,@yaseenpress2004
2025-11-30,16:51:53,Gaza,Otros,"""Liberen a Marwan... una campaña mundial dirigida por la familia del prisionero Marwan Barghouti, con el apoyo de organizaciones de la sociedad civil británica, para que la causa de los prisioneros palestinos más importantes vuelva a ocupar el primer plano de la presión internacional y exija su liberación.",,,,@yaseenpress2004
2025-11-30,16:51:53,Gaza,Otros,Las fuerzas de ocupación detuvieron a un joven del barrio de Sheikh Jarrah en la Jerusalén ocupada después del ataque.,,,,@yaseenpress2004
2025-11-30,16:51:53,Gaza,Otros,"El diario ""Ha ' aretz"" Ben Gfir informó al comandante de la unidad de la Guardia de Fronteras de la Ribera Occidental de que sería ascendido un día después de que sus miembros ejecutaran a palestinos en Jenin.",,,,@yaseenpress2004
2025-11-30,16:51:53,Gaza,Otros,"Fuentes locales: Las fuerzas de ocupación atacan a Haj Ismail Sabir Shaqir, de la localidad de Al-Naya, en Salfit, durante su detención y una investigación sobre el terreno.",,,,@yaseenpress2004
2025-11-30,16:51:53,Gaza,Otros,El ex dirigente del Partido Laborista Británico y el diputado independiente Jeremy Corbin declaran que el programa del nuevo partido que fundó prevé el apoyo a Palestina.,,,,@yaseenpress2004
2025-11-30,16:51:53,Gaza,Terrorismo,"Fuentes libanesas: La ocupación bombardea una excavadora en el barrio de Wastani, en la ciudad de Shabaa, en el Líbano meridional.",,,,@yaseenpress2004
2025-11-30,16:51:53,Gaza,Otros,"La Autoridad de Radiodifusión de Israel informa de una fuente de seguridad en la Potencia ocupante: ""Irán vuelve a armarse por temor a otra operación que el ejército israelí podría llevar a cabo en su territorio en breve y ha reanudado sus esfuerzos para armar a sus aliados en el Yemen, el Líbano y Siria, lo que preocupa al sistema de seguridad israelí"".",,,,@yaseenpress2004
2025-11-30,16:51:53,Gaza,Otros,"Las fuerzas de ocupación detienen a los prisioneros liberados Mahmoud Ibrahim Thawata, Issam Hussein Dairieh y su hermano Ibrahim, Mohamed Ahmed Abu Yabbs y Bra ' eb Yussef Dairiya, de la localidad de Beit Fajar, al sur de Belén, hoy por la mañana.",,,,@yaseenpress2004
2025-11-30,16:51:53,Gaza,Otros,La ocupación rechaza el intento de contrabando de armas a través de un avión que pasa por el oeste de la Palestina ocupada en la frontera con Egipto.,,,,@yaseenpress2004
2025-11-30,16:51:53,Gaza,Otros,"Fuentes locales: La ocupación está llevando a cabo un ataque aéreo al este del barrio de Al-Qayya, en la ciudad de Gaza.",Gaza City,31.520,34.450,@yaseenpress2004
2025-11-30,16:51:53,Gaza,Otros,"El infierno del desplazamiento y la tragedia de las familias del hijo... es una trágica historia para la madre del prisionero Hassan Abu Atik, del campamento de Tulkarem.",,,,@yaseenpress2004
2025-11-30,16:51:53,Gaza,Conflicto Armado,"Reportero militar del periódico Ma ' aref, Avi Ashkenazy: El ejército se enfrenta a una escasez de 12.000 soldados, es decir, del tamaño de una división regular. La ley de reclutamiento que se está examinando no responderá a las necesidades del ejército israelí.",,,,@yaseenpress2004
2025-11-30,16:51:53,Gaza,Otros,"""Ejecutaron a mi marido delante del mundo y robaron su cuerpo... la esposa del mártir Al-Mutzir Abdullah, hablando con dolor de él y de la ejecución de los soldados de ocupación en Jenin.",,,,@yaseenpress2004
2025-11-30,16:51:53,Gaza,Otros,Fuentes locales: Las fuerzas especiales de ocupación irrumpieron en la Ciudad Vieja de Naplusa y arrestaron a un joven.,,,,@yaseenpress2004
2025-11-30,16:51:53,Gaza,Otros,Desde donde la Fuerza Especial de la Ocupación entró en la Ciudad Vieja de Naplusa.,,,,@yaseenpress2004
2025-11-30,16:51:53,Gaza,Otros,Fotografía: Las fuerzas de ocupación irrumpieron en la Ciudad Vieja de Naplusa.,,,,@yaseenpress2004
2025-11-30,16:51:53,Gaza,Terrorismo,La ocupación lanza bombas de gas durante la invasión de la Ciudad Vieja de Naplusa.,,,,@yaseenpress2004
2025-11-30,16:51:53,Gaza,Otros,Una nueva escena de las fuerzas de ocupación irrumpiendo en la Ciudad Vieja de Naplusa.,,,,@yaseenpress2004
2025-11-30,16:51:53,Gaza,Terrorismo,Corresponsal de la red de Jerusalén: las fuerzas de ocupación lanzan bombas de humo para asegurar la retirada de sus fuerzas especiales tras la detención de un joven palestino en la ciudad antigua de Naplusa,,,,@yaseenpress2004
2025-11-30,16:51:53,Gaza,Otros,Fuentes locales: Las fuerzas especiales de ocupación arrestan al joven Asad Al-Sumhan en la Ciudad Vieja de Naplusa.,,,,@yaseenpress2004
2025-11-30,16:51:53,Gaza,Otros,"Bajo la vigilancia de la ocupación, los colonos están haciendo rituales templados frente al estanque occidental cerca de la Roca en la mezquita de Al-Aqsa.",,,,@yaseenpress2004
2025-11-30,16:51:53,Gaza,Otros,"Un palestino documenta la destrucción masiva en el barrio de Al-Zaiya, al este de la ciudad de Gaza.",Gaza City,31.520,34.450,@yaseenpress2004
2025-11-30,16:51:53,Gaza,Otros,"Las fuerzas de ocupación irrumpieron en la ciudad de Beit Djinn, al este de Naplusa, y irrumpieron en viviendas en el barrio occidental.",,,,@yaseenpress2004
2025-11-30,16:51:53,Gaza,Otros,"La Ministra de Comunicaciones de la Ocupación Miri Rigff confirma el inicio de los trabajos en un tren que une la ocupación con los Emiratos Árabes Unidos, pasando por Arabia Saudita y Jordania.",,,,@yaseenpress2004
2025-11-30,16:51:53,Gaza,Otros,"Ministro de Relaciones Exteriores del Pakistán, Mohamed Itzhak Dar: Pakistán está listo para enviar tropas a la Fuerza Internacional de Paz en la Franja de Gaza, pero no participará en la cuestión del desarme de Hamas.",Gaza City,31.520,34.450,@yaseenpress2004
2025-11-30,16:51:53,Gaza,Otros,"""Miles de oficiales huyen... el ejército israelí está atravesando una crisis de poder humano sin precedentes que amenaza su capacidad de acción, miles de oficiales y suboficiales piden la desmovilización, los jóvenes se niegan a firmar un servicio permanente y la calidad de la fuerza humana se deteriora.",,,,@yaseenpress2004
2025-11-30,16:51:53,Gaza,Otros,"Las fuerzas de ocupación están arrestando a dos jóvenes en la aldea de Qara ' at Beni Hasan, al oeste de Salfit, esta mañana.",,,,@yaseenpress2004
2025-11-30,16:51:53,Gaza,Otros,"Decenas de colonos siguen irrumpiendo en la mezquita de Al-Aqsa, bendecida por la ocupación.",,,,@yaseenpress2004
2025-11-30,16:51:53,Gaza,Otros,"""Amaneceron en la zona al amanecer, y la gente se quedó dormida, golpeando y robando a los padres y a los simpatizantes, colonos que atacaban brutalmente a los palestinos y a los simpatizantes extranjeros en la aldea de Diok al-Fawqa, al norte de Jericó.",,,,@yaseenpress2004
2025-11-30,16:51:53,Gaza,Otros,"OOPS: - La población de Gaza necesita una corriente continua de asistencia humanitaria. - La labor del OOPS en Gaza debe volver a su máximo potencial, incluida la entrega de suministros y servicios.",Gaza City,31.520,34.450,@yaseenpress2004
2025-11-30,16:51:53,Gaza,Otros,Continuación: Las fuerzas de ocupación están irrumpiendo en la ciudad de Al-Isawiya en Jerusalén ocupada.,,,,@yaseenpress2004
2025-11-30,16:51:53,Gaza,Otros,"Golpes, sabotajes, horrores... la Sra.",,,,@yaseenpress2004
2025-11-30,16:51:53,Gaza,Otros,"A pesar del bloqueo y de la falta de medios, un médico de Gaza está desarrollando un aparato renal para tratar a los pacientes de plaquetas con falta de equipo médico.",Gaza City,31.520,34.450,@yaseenpress2004
2025-11-30,16:51:53,Gaza,Otros,"Una violación constante... canto, aplausos y ceremonias públicas durante la incursión de los colonos en la mezquita de Al-Aqsa bajo la vigilancia de las fuerzas de ocupación desde las horas de la mañana.",,,,@yaseenpress2004
2025-11-30,16:51:53,Gaza,Otros,"Hace dos meses fue puesto en libertad por las fuerzas de ocupación, que volvieron a detener al prisionero liberado, el periodista Mohamed Atseida, de su casa en la aldea de Tel al-Faŷr.",,,,@yaseenpress2004
2025-11-30,16:51:53,Gaza,Otros,"Fue testigo del ataque perpetrado ayer por las milicias de colonos contra una casa palestina en Jalil al-Louz, al sur de Belén.",,,,@yaseenpress2004
2025-11-30,16:51:53,Gaza,Otros,"La esposa del mártir, el “Musir Abdullah”, de Jenin, habla de su esposo y pide que se le devuelva el cuerpo.",,,,@yaseenpress2004
2025-11-30,16:51:53,Gaza,Otros,La televisión iraní muestra un vídeo que documenta el momento en que un avión teledirigido HERON TP del ejército de ocupación israelí fue derribado con un misil AD-08 del sistema de defensa aérea Majid durante la guerra de verano.,,,,@yaseenpress2004
2025-11-30,16:51:53,Gaza,Disturbios Civiles,"Protestas constantes en París, en apoyo de Gaza y Palestina y condenando los crímenes de ocupación.",Gaza City,31.520,34.450,@yaseenpress2004
2025-11-30,16:51:53,Gaza,Otros,"""Indescriptible"" es un prisionero de Gaza que cuenta los detalles de su tortura en las cárceles de ocupación y de la transformación de la Franja de Gaza durante la guerra de exterminio.",Gaza City,31.520,34.450,@yaseenpress2004
2025-11-30,16:51:53,Gaza,Disturbios Civiles,El Movimiento Unificado de Maestros comenta la decisión de la Unión General de Científicos de declarar huelga en las escuelas.,,,,@yaseenpress2004
2025-11-30,16:51:53,Gaza,Otros,"Europa está gritando por Palestina, manifestaciones que se extienden de una ciudad a otra, y las voces de los manifestantes se niegan a exterminar y condenan los crímenes de ocupación.",,,,@yaseenpress2004
2025-11-30,16:51:53,Gaza,Otros,Sincronización: elderman Traducción: ilse,,,,@yaseenpress2004
2025-11-30,16:51:53,Gaza,Otros,"Canal 15 Hebreo: Netanyahu se presentó bajo presión de Trump a petición del presidente israelí Hertzwig para que lo perdonara en los casos de corrupción que se le juzgaban, a pesar de haber negado antes su intención de solicitarlo.",,,,@yaseenpress2004
2025-11-30,16:51:53,Gaza,Disturbios Civiles,Protestas en Roma en apoyo de Palestina en medio de llamamientos de los manifestantes para que se rompan las relaciones con la ocupación,,,,@yaseenpress2004
2025-11-30,16:51:53,Gaza,Otros,"Seguimiento: las milicias de colonos están saboteando los sistemas de abastecimiento de agua para la agricultura de regadío en decenas de dunums en la zona farsi, en el norte del país.",,,,@yaseenpress2004
2025-11-30,16:51:53,Gaza,Terrorismo,El periódico The Jerusalem Post: más de 100 abogados envían una carta en apoyo de una petición oficial de que se deje sin efecto la clasificación de Hamas como organización terrorista en el Reino Unido,,,,@yaseenpress2004
2025-11-30,16:51:53,Gaza,Otros,Un colono se atasca y cierra el camino entre Jericó y Ramallah.,,,,@yaseenpress2004
2025-11-30,16:51:53,Gaza,Otros,"- Corresponsal de la red de Jerusalén: las Brigadas Qassam y la Cruz Roja están buscando el cadáver de un prisionero israelí al este del campamento de Jabaliya, al norte del sector.",Jabalia,31.534,34.495,@yaseenpress2004
2025-11-30,16:51:53,Gaza,Otros,"El movimiento Hamas: - lo que el nuevo periódico Al-Araby publicó como “fuente principal de Hamas” sobre la escalada y llena de vacíos de liderazgo es infundado. - El movimiento lamenta que se hayan difundido noticias de ese tipo sin que se hayan confirmado con referencia al movimiento, lo que pondría a los dirigentes de nuestro pueblo en peligro de ser blanco.",,,,@yaseenpress2004
2025-11-30,16:51:53,Gaza,Otros,En el momento en que las fuerzas especiales de ocupación se infiltraron en la Ciudad Vieja de Naplusa y el joven fue detenido Asad Al-Samahn.,,,,@yaseenpress2004
2025-11-30,16:51:53,Gaza,Otros,"En el momento en que la Fuerza Especial se infiltró en la Ciudad Vieja de Naplusa, hace unas horas, el joven Asad Al-Summan fue arrestado.",,,,@yaseenpress2004
2025-11-30,16:51:53,Gaza,Otros,"Un equipo de la Cruz Roja y las Brigadas Qassam está realizando una inspección para encontrar el cadáver de un prisionero israelí en Beit Lahiya, al norte de la ciudad de Gaza.",Gaza City,31.520,34.450,@yaseenpress2004
2025-11-30,16:51:53,Gaza,Otros,Fuentes hebreas: Las operaciones en curso del ejército de ocupación y las intenciones de los colonos sirios impulsarán a la población local a formar una nueva resistencia en el frente sirio.,,,,@yaseenpress2004
2025-11-30,16:51:53,Gaza,Otros,"• Desde la cesación del fuego (11 de octubre de 2025): 356; total: 607: 908 - total: 607. Los resultados de la agresión han aumentado a 70,103; 170,985 desde el 7 de octubre de 2023.",Gaza City,31.520,34.450,@yaseenpress2004
2025-11-30,16:51:53,Gaza,Otros,"El ex ministro del ejército de ocupación, Moshe Yalun: la petición de perdón del acusado que dirige el gobierno me recuerda al asesino de sus padres que pidió clemencia porque era un huérfano.",,,,@yaseenpress2004
2025-11-30,16:51:53,Gaza,Otros,"Un colono, con la protección del ejército de ocupación, ataca a la población en la reunión de los beduinos Al-Amara, cerca de Ŷaba, al norte de la Jerusalén ocupada",,,,@yaseenpress2004
2025-11-30,16:51:53,Gaza,Otros,Ministro de Relaciones Exteriores del Irán: Hay que poner fin a las matanzas del pueblo palestino.,,,,@yaseenpress2004
2025-11-30,16:51:53,Gaza,Otros,Oficina de Información Pública: 591 violaciones del acuerdo de cesación del fuego cometidas por el ejército de ocupación que causaron 357 mártires y 903 heridos,,,,@yaseenpress2004
2025-11-30,16:51:53,Gaza,Otros,La ocupación está realizando un ataque aéreo contra el sur de la ciudad de Gaza.,Gaza City,31.520,34.450,@yaseenpress2004
2025-11-30,16:51:53,Gaza,Otros,Federación de Municipalidades de la Franja de Gaza: más de 4 millones de toneladas de escombros en las calles de la Franja de Gaza,Gaza City,31.520,34.450,@yaseenpress2004
2025-11-30,16:51:53,Gaza,Otros,Continuación de la campaña de solidaridad con los prisioneros palestinos en las cárceles de la ocupación en Londres,,,,@yaseenpress2004
2025-11-30,16:51:53,Gaza,Otros,El Ministerio de Salud de Gaza presenta problemas difíciles que obstaculizan la prestación continua de atención especializada a los pacientes oftalmológicos en la Franja de Gaza. El deterioro de los dispositivos de diagnóstico y cirugía ha hecho más difíciles las intervenciones quirúrgicas y ha aumentado la espera de las operaciones.,Gaza City,31.520,34.450,@yaseenpress2004
2025-11-30,16:51:53,Gaza,Otros,"El prisionero, el editor Mohamed Sulameh, relata la amarga realidad de los prisioneros en las cárceles de ocupación.",,,,@yaseenpress2004
2025-11-30,16:51:53,Gaza,Otros,"El ejército de ocupación está distribuyendo notificaciones de demolición y interrupción de la construcción de instalaciones en la aldea de Yasuf, cerca de Salfit, hoy.",,,,@yaseenpress2004
2025-11-30,16:51:53,Gaza,Otros,"La municipalidad de Sobot (Polonia) ha interrumpido sus relaciones con la municipalidad de ocupación de Ashkelon. En la decisión adoptada en el ayuntamiento se señala que ""desde 2023 se ha llevado a cabo una depuración étnica completa en la Franja de Gaza"".",Gaza City,31.520,34.450,@yaseenpress2004
2025-11-30,16:51:53,Gaza,Otros,Las Naciones Unidas: la ocupación ha destruido el 90% de las plantas de abastecimiento de agua de Gaza desde el comienzo del genocidio,Gaza City,31.520,34.450,@yaseenpress2004
2025-11-30,16:51:53,Gaza,Disturbios Civiles,"En una declaración con los Ministerios de Educación y Finanzas, la Federación General de Maestros, comentamos la suspensión de los actos de protesta anunciados ayer.",,,,@yaseenpress2004
