fecha,hora,pais,categoria_sicu,descripcion,localizacion,lat,lon,fuente
2025-11-17,17:24:30,Libia,Otros,El precio del oro se estabilizó durante las transacciones del lunes... en las que las onzas se comercializaron a un nivel de $4080...,,,,@almasartvlibya
2025-11-17,17:26:34,Libia,Otros,"Volcanología: Unveiling the Secrets of Earth's Fiery Profundities  Volcanología: Un viaje al corazón del fuego Profundo dentro de la corteza terrestre, un caldero de rocas fundidas y minerales absorbe, a la espera de desatar su furia sobre la superficie. Volcanología, el estudio científico de volcanes, busca entender los procesos complejos que rigen estas maravillas geológicas.Al adentrarnos en el mundo de la volcanología, nos encontramos en contacto con las temperaturas sobre los grados de la capa de ozono, la capa de ozono, la capa de ozono y la capa de ozono.  [Enlace: https://libyaobserver.ly/cdn-cgi/content?id=DY5Tpv7xaMrABsMIRt1qK8Bu5PEab63o0KUJjeWSNP4-1763393192.2771382-1.0.1.1-vAtKmkBQAmpq6iR4jazOrX8BZe9nCQrXQMD0ZBM.xu4]",,,,WEB libyaobserver.ly
2025-11-17,17:26:37,Libia,Otros,"La plataforma libia - Mashashij y Asaiyan, tribus de la costa occidental, confirman su apoyo al liderazgo público y su disposición a desempeñar un papel eficaz en el mantenimiento de la cohesión social y en la lucha contra todo lo que afecte a la estabilidad y la unidad del país.  %85%d8%d8%d8 %d9%d9%d8%d8%d9%d8%d9%d8%d9%d9%d%d9%d9%d%d9%d9%d9%8%d%d9%d9%8%%d9%d8%d8%8%8%d8%d8%8%d8%d8%d8%d8%d%d8%d8%d8%d8%d8%d%d%d8%d%d%d8%d8%d.  [Enlace: https://almenassa.ly/2025/11/17/%d9%85%d8%b4%d8%a7%d9%8a%d8%ae-%d9%88%d8%a3%d8%b9%d9%8a%d8%a7%d9%86-%d9%82%d8%a8%d8%a7%d8%a6%d9%84-%d8%a7%d9%84%d8%b3%d8%a7%d8%ad%d9%84-%d8%a7%d9%84%d8%ba%d8%b1%d8%a8%d9%8a-%d9%8a%d8%a4%d9%83%d8%af/]",,,,WEB almenassa.ly
2025-11-17,17:26:38,Libia,Conflicto Armado,La plataforma libia – Comandante en Jefe de las Fuerzas Armadas recuerda que los miembros de las tribus libias se unieron a sus familias en la ciudad de Darna durante el desastre del huracán Daniels ( %9 %d9%d9 %84%d9%d9%d8 %d8 %d8 %d6a6 %d8%d9%d9%d9%d9%8%%d9%8%d9%%d9%8%d9%d9%8 %d9%d9%d9%%d9%d9%8 %d9%d9%8%d8%d8 %d8%d8%d8%a-%d8a-%d8a-%d8a-%d8%d@aaa ad8%d8%d%d%d8%d%d9%d%d9%d%d9%d%d8%d/%d8%d8%d%d%d%d8a%d9%d9%d9%d9%d9%d9%8%d8%d8%d%8%domakd%d8%d8%d8%domakd8%d8%domaf.  [Enlace: https://almenassa.ly/2025/11/17/%d8%a7%d9%84%d9%82%d8%a7%d8%a6%d8%af-%d8%a7%d9%84%d8%b9%d8%a7%d9%85-%d9%84%d9%84%d9%82%d9%88%d8%a7%d8%aa-%d8%a7%d9%84%d9%85%d8%b3%d9%84%d8%ad%d8%a9-%d9%8a%d8%b3%d8%aa%d8%b0%d9%83%d8%b1-%d9%88%d9%82/],,,,WEB almenassa.ly
2025-11-17,17:30:31,Libia,Otros,"El municipio de Beni-Walid vuelve a poner en marcha el código financiero después de años de interrupción, lo que le permitirá contar con una ventana financiera independiente que contribuya a acelerar los procedimientos  y  mejorar los servicios, realizar las transacciones del personal y liberar los sueldos suspendidos.",,,,@sefr0ly
2025-11-17,17:36:24,Libia,Otros,"Reliability Engineering: The Science of Failure Prevention  Reliability Engineering: The Science of Failure Prevention A medida que navegamos las complejidades de la tecnología moderna, la importancia de la ingeniería de fiabilidad no puede exagerarse. Este campo de estudio multidisciplinario se centra en el diseño, desarrollo e implementación de sistemas que pueden soportar la prueba de tiempo, minimizando la probabilidad de fracaso y maximizando el rendimiento global.  [Enlace: https://libyaobserver.ly/cdn-cgi/content?id=lNVjl3jWdMsN1wOTZszZYbUBEkEvfDcnxmVbtpvtZns-1763393782.8675926-1.0.1.1-che2.Warh9fUrNpqGF.9n1V0F0zi.p.7uS4BCDBTjZI]",,,,WEB libyaobserver.ly
2025-11-17,17:42:47,Libia,Otros,Do pear a gear a gear a gear a gear a gear a gear a gear a gear a gear a gear a gear a gear a gear a gear a gear a gear a gear a gear a gear a gear a gear a gear a gear a gear a gear a gear a gear a gear a gear a gear a gear a gear a gear a gear a gear a gear a gear a gear a gear a gear a gear a gear a gear a gear a gar a gear a gear a gear a gear a gear a gear a gear a gear a gear a gear a gear a gear a gear a gear a gear a gear a gear a gear a gear a gear a gear a gear a gear a gear a gear a gear a gear a gear a gear a gear a gear.  [Enlace: https://libyaobserver.ly/cdn-cgi/content?id=YnagXipoi.KMXHtCxP2mPsIaR4kQfXAstf7Q77P_XJs-1763394166.1797407-1.0.1.1-HjeQxT1VgXvL8a.7xoSs3tlFcnYLqs95JEeBq0X4NNc],,,,WEB libyaobserver.ly
2025-11-17,17:52:21,Libia,Otros,"Cheminformática: Desbloquear los secretos de las interacciones moleculares  Cheminformática: una sinfonía de los materiales y datos En el ámbito de la quimioinformática, los límites entre la química y los patrones de la ciencia informática se difuminan, dando lugar a un campo fascinante que busca comprender la intrincados interacciones moleculares.A medida que profundizamos en este mundo cautivante, exploraremos el concepto de la biotecnología, sus aplicaciones, y los principios científicos que subyacen a su poder.  [Enlace: https://libyaobserver.ly/cdn-cgi/content?id=CiLrzB15sxMantZcroLF848FyYBU3zu1hwa5wjTGfFA-1763394739.7180805-1.0.1.1-txfYktTIY7Pms8JglKpwl3QMfD2MnKBsjYEblGvqdyo]",,,,WEB libyaobserver.ly
2025-11-17,17:52:24,Libia,Otros,"Plataforma libia - Presidente de la Dirección de Lucha contra la Inmigración Ilícita de la Brigada Salah Al-Leghi, debate con el Director de Seguridad del GATT sobre el fortalecimiento de la coordinación conjunta y el desarrollo de los mecanismos de seguridad en la siguiente dirección:  %d9%d9%d8%d8%d8%d9%d9%d8%d8%d%d8%d8%d9%d%d8%d9%d%d8%d9%d%d9%d9%d8%d8%d9%d9%d8%d8%8%%d8%d8%d8%8%d8%d8%d8%d%d8%d8%d8%d8%d8%d%d8%d8%d8%d%d8%dac%d8%d8%d9%d9%d9%d9%d8%d%dov%d8%d8%d8%d8%d8%dz.%d8%d8ajakdomas%d9%d9%d9%d8%d8%dom%dom%d8%dom%dom.  [Enlace: https://almenassa.ly/2025/11/17/%d8%b1%d8%a6%d9%8a%d8%b3-%d8%ac%d9%87%d8%a7%d8%b2-%d9%85%d9%83%d8%a7%d9%81%d8%ad%d8%a9-%d8%a7%d9%84%d9%87%d8%ac%d8%b1%d8%a9-%d8%ba%d9%8a%d8%b1-%d8%a7%d9%84%d8%b4%d8%b1%d8%b9%d9%8a%d8%a9-%d9%84%d9%88/]",,,,WEB almenassa.ly
2025-11-17,17:52:25,Libia,Otros,"El Gobierno de Libia está dictando una decisión por la que se establece el Servicio de Protección de la Mujer y el Niño como órgano de vigilancia independiente con facultades inmediatas, en  [Enlace: https://almenassa.ly/2025/11/17/%d8%a7%d9%84%d8%ad%d9%83%d9%88%d9%85%d8%a9-%d8%a7%d9%84%d9%84%d9%8a%d8%a8%d9%8a%d8%a9-%d8%aa%d8%b5%d8%af%d8%b1-%d9%82%d8%b1%d8%a7%d8%b1%d8%a7-%d9%8a%d9%82%d8%b6%d9%8a-%d8%a8%d8%a5%d9%86%d8%b4%d8%a7/]",,,,WEB almenassa.ly
2025-11-17,17:55:10,Libia,Otros,"*La economía de la ruta * los activistas de Trípoli negocian que varios grandes mercados planean lanzar una campaña de boicot para las empresas que sólo manejan dinero en efectivo, así como para otras que fijan un precio diferente para las mercancías utilizando transferencias bancarias.",,,,@almasartvlibya
2025-11-17,17:55:10,Libia,Criminalidad,"Asesor de Hafter: Libia ha vivido la fase de la economía del crimen desde el fin de la era del Comandante Muammar Gaddafi • Mohamed Buyseer, ex asesor político de los Estados Unidos Khalifa Hafter, dijo que Libia había vivido desde el final de la era del mártir Muammar Gaddafi.",,,,@gplusss
2025-11-17,17:55:11,Libia,Terrorismo,"La primera es la violencia social, que requiere una mayor conciencia pública de la importancia de la participación en la sociedad libia. La segunda es la violencia física, que requiere la promulgación de leyes que eliminen los problemas y obstáculos que impiden su participación.",,,,@libyapress
2025-11-17,18:02:05,Libia,Conflicto Armado,El subsecretario de Defensa Abdussalam Zubi se reúne con algunos militares de Misrata.,,,,@gplusss
2025-11-17,18:02:22,Libia,Otros,"Digital Logic: The Poetry of Binary Code  En el ámbito de la lógica informática, reina la lógica digital, un reino de código binario donde 0s y 1s bailan en patrones intrincados. Al igual que un poeta experto, el lógico digital teje un tapiz de tablas de verdad, puertas y circuitos, dando lugar al tejido de la computación moderna.  [Enlace: https://libyaobserver.ly/cdn-cgi/content?id=hi1Jis6S8zlrnVyFu12rF_DRYFN..5nH0lKjVog3dzA-1763395341.2036126-1.0.1.1-IyPydbt5nIqE2OQrWUA5neSJ7KO9lNpn8r5sa5lqZds]",,,,WEB libyaobserver.ly
2025-11-17,18:04:07,Libia,Otros,"Presentado por el General de División 444 del ejército libio, el Hospital de Accidentes de Azlim anuncia que recibe un envío de medicamentos y suministros médicos esenciales, para reforzar la capacidad del hospital y mejorar los servicios que se prestan a los ciudadanos.",,,,@sefr0ly
2025-11-17,18:12:31,Libia,Otros,"Los componentes de la pila de combustible para la generación de energía, la generación de energía y la generación de energía, la generación de energía, la generación de energía, la generación de energía y la generación de energía, la generación de energía, la generación de energía, la generación de energía, la generación de energía, la generación de energía, la generación de energía, la generación de energía, la generación de energía, la generación de energía, la generación de energía, la generación de energía, la generación de energía y la generación de energía.  [Enlace: https://libyaobserver.ly/cdn-cgi/content?id=3_7IjnbvXBOi__VgdMsfV94FMScTz8YsJYM2RWVXvOU-1763395950.479236-1.0.1.1-9Tur0NXZyZxV9xSqDXz7OjIivx9vv0ptCVt3sHcPacg]",,,,WEB libyaobserver.ly
2025-11-17,18:13:01,Libia,Otros,"Plataforma libia - Enviada de las Naciones Unidas, Hannah Teteh, acoge con beneplácito la financiación nacional del proyecto de promoción del diálogo político y las contribuciones humanitarias conjuntas en Libia,  [Enlace: https://almenassa.ly/2025/11/17/%d8%a7%d9%84%d9%85%d8%a8%d8%b9%d9%88%d8%ab%d8%a9-%d8%a7%d9%84%d8%a3%d9%85%d9%85%d9%8a%d8%a9-%d9%87%d8%a7%d9%86%d8%a7-%d8%aa%d9%8a%d8%aa%d9%8a%d9%87-%d8%aa%d8%b1%d8%ad%d8%a8-%d8%a8%d8%a7%d9%84%d8%aa/]",,,,WEB almenassa.ly
2025-11-17,18:13:02,Libia,Otros,El Ministro del Petróleo del Gobierno de Unidad Nacional examina con el Embajador de Argelia las posibilidades de promover la cooperación en el sector de la energía:  [Enlace: https://almenassa.ly/2025/11/17/%d9%88%d8%b2%d9%8a%d8%b1-%d8%a7%d9%84%d9%86%d9%81%d8%b7-%d8%a8%d8%ad%d9%83%d9%88%d9%85%d8%a9-%d8%a7%d9%84%d9%88%d8%ad%d8%af%d8%a9-%d8%a7%d9%84%d9%88%d8%b7%d9%86%d9%8a%d8%a9-%d9%8a%d9%86%d8%a7%d9%82/],,,,WEB almenassa.ly
2025-11-17,18:15:06,Libia,Criminalidad,"¶ presenciar el dispositivo de apoyo a las Direcciones derriba a un joven y una chica formando una pandilla para atraer a los ciudadanos a cometer vicios y fotografiarlos en situaciones invasivas, para chantajearlos por dinero. ¶",,,,@sefr0ly
2025-11-17,18:22:50,Libia,Otros,"Developing the Mysteries of Computational Fluid Dynamics  Introducción a la dinámica de fluidos computacional (CFD) es una rama de la física que utiliza métodos numéricos y algoritmos para analizar y predecir el comportamiento de los fluidos y gases en diversas condiciones. Este campo se ha vuelto cada vez más importante en los últimos años, con aplicaciones en campos como la ingeniería aeroespacial, la ingeniería química y la meteorología.  [Enlace: https://libyaobserver.ly/cdn-cgi/content?id=4epo7uDtk5aBUEgm5n6j331Pn8aEurwyAaG.0rUkRAk-1763396568.187056-1.0.1.1-gyA1fOKO5dALxNT4JT0SEsK6rT1wlPy7LYxOYCXomTU]",,,,WEB libyaobserver.ly
2025-11-17,18:22:53,Libia,Otros,"En la ciudad de Benghazi, el Presidente del Gobierno libio inaugurará la primera fase del proyecto del Lotus Complejo en presencia del Presidente del Consejo de Administración de la Corporación de Reconstrucción de Libia (  [Enlace: https://almenassa.ly/2025/11/17/%d8%b1%d8%a6%d9%8a%d8%b3-%d8%a7%d9%84%d8%ad%d9%83%d9%88%d9%85%d8%a9-%d8%a7%d9%84%d9%84%d9%8a%d8%a8%d9%8a%d8%a9-%d9%8a%d9%81%d8%aa%d8%aa%d8%ad-%d8%a8%d9%85%d8%af%d9%8a%d9%86%d8%a9-%d8%a8%d9%86%d8%ba/]",,,,WEB almenassa.ly
2025-11-17,18:41:59,Libia,Otros,"- El nuevo experto económico Mukhtar dijo que el Fondo Monetario Internacional (FMI) no había añadido nada a la economía libia, y que todo lo que había dicho en su diagnóstico de la realidad económica libia no estaba fuera del alcance de la jurisdicción libia, ya sea por conducto de canales o plataformas de comunicación. - El nuevo había añadido a través de Facebook que el Fondo había tomado lo que se decía y lo había reestructurado para que pareciera más elegante y más coordinado, como si estuviera reempañando dulces en paquetes para facilitar su comercialización.",,,,@gplusss
2025-11-17,18:41:59,Libia,Otros,"El novio que murió hace dos días fue perseguido de la misma manera por su hermano, S. Neg, en el mismo lugar que Mohammed - Fathi- al-Zaydi -muerte hace dos días .",,,,@jraimalmlyshyat
2025-11-17,18:41:59,Libia,Terrorismo,"Documentos publicados por el activista de derechos humanos Hussam Al Qamati, que revela irregularidades financieras y administrativas relacionadas con la administración de la antigua Sociedad Islámica y algunas personas que habían estado vinculadas a misiones y lugares en el sistema de promoción en el extranjero.",,,,@libyapress
2025-11-17,18:41:59,Libia,Otros,"Un 34,2% más que el año pasado, Libia es el quinto proveedor más importante de joyas turcas, conocido con cero estadísticas.",,,,@sefr0ly
2025-11-17,18:48:55,Libia,Hazards,"El Comité Nacional de Salud de la Cámara de Representantes emitió una declaración muy enérgica sobre el empeoramiento del sufrimiento de los pacientes debido a la interrupción del sistema de tratamiento y a la falta de justicia, señalando que la burocracia y la negligencia habían causado la muerte de casos que estaban pendientes de aprobación médica. El Comité pidió al Ministerio Público y a los órganos de supervisión que iniciaran una investigación urgente y exhaustiva de las irregularidades administrativas y financieras en los servicios de salud, y que rindieran cuentas a todos los funcio...",,,,@libyabreaking
2025-11-17,18:49:31,Libia,Hazards,"En este artículo, la especialidad médica que utiliza la radiación para diagnosticar y tratar enfermedades, ha revolucionado el campo de la salud, explorando sus principios, aplicaciones, y los avances más recientes en el campo de la radiación, la radiología se ha convertido en una herramienta indispensable tanto para médicos como para investigadores.En este artículo, profundizaremos en el mundo fascinante de la radiología, en la exploración de sus aplicaciones, en la tecnología de la tecnología de la información y en la tecnología de la información y la comunicación.  [Enlace: https://libyaobserver.ly/cdn-cgi/content?id=T8FqBlGF02uw7wePo18Whwkj54.B_Xg3mkq0qW3_E5w-1763398169.2314534-1.0.1.1-hNvpVys823C_iH4vEmffuNyAu6dPFDNC9mkicPv4OzM]",,,,WEB libyaobserver.ly
2025-11-17,18:50:54,Libia,Otros,"El comité organizador de la Federación Libia de Fútbol aprueba oficialmente los resultados de los partidos semifinales de la Copa Libia, con la victoria de mi equipo, de Trípoli y de Benghazi, y siendo mis futuros finalistas sin programar hasta ahora.",,,,@sefr0ly
2025-11-17,18:51:55,Libia,Otros,"Un avión de carga Boeing sale de Estambul y llega al aeropuerto de Benina en Benghazi, al este de Libia.",,,,@gplusss
2025-11-17,18:52:54,Libia,Otros,¿Cuál es la culpa de esta persona?,,,,@jraimalmlyshyat
2025-11-17,18:53:59,Libia,Terrorismo,"Unveiling the Mysteries of Superconductivity  Introducción a la superconductividad: un salto cuántico en la electricidad En el corazón de la física moderna se encuentra un fenómeno que ha cautivado a científicos e ingenieros por igual durante más de un siglo - superconductividad. Esta extraordinaria propiedad, donde ciertos materiales pueden conducir electricidad con cero resistencia, ha revolucionado nuestra comprensión de la mecánica cuántica y tiene el potencial de transformar la forma de generar, transmitir y utilizar electricidad a gran escala.  [Enlace: https://libyaobserver.ly/cdn-cgi/content?id=gHgbNTQ7H2KpSFIExVHQWnRcv_Fq63ZhA8EKOi88vn0-1763398438.4007902-1.0.1.1-QNbWapLB33ZNZT2xbgB8oiIHPe76RACDitaV.KxmZA4]",,,,WEB libyaobserver.ly
2025-11-17,18:59:53,Libia,Otros,El gobierno libio decide crear un dispositivo de protección para el niño y las mujeres.,,,,@almasartvlibya
2025-11-17,19:04:12,Libia,Otros,"Anesthesiology: The Science of Pain Management  Anesthesiology: The Science of Pain Management Anesthesiology es una rama de la medicina que se ocupa de la administración de anestésicos para aliviar el dolor durante los procedimientos médicos. Se trata de un campo complejo que requiere una comprensión profunda de la fisiología humana, la farmacología y la psicología.  [Enlace: https://libyaobserver.ly/cdn-cgi/content?id=OlsavVplZuSEyB2QZ22kQIjzTGpk6UaV9FMJitBWlyM-1763399051.5815659-1.0.1.1-3mCbRFwSwWhF38wm9z5WMXbm.VR1OUxTDoSwJCZiunk]",,,,WEB libyaobserver.ly
2025-11-17,19:12:54,Libia,Otros,"• El analista económico explicó que los ingresos obtenidos por Arcano se dividían entre el campamento de Hafter oriental y algunos dirigentes occidentales. • Abubakar señaló que la factura de los combustibles ascendía a 32.000 millones de dólares en 2025, después de que sólo 16.000 millones de dólares en 2024.",,,,@gplusss
2025-11-17,19:13:55,Libia,Otros,"Los centros de control y prevención de enfermedades de la Unión Africana reciben una denuncia de las autoridades etíopes sobre el raro brote del virus Marburg, que se transmite a través de los murciélagos del sur del país, confirmando que el virus ha alcanzado la magnitud de la epidemia después de casi el 90% de las muertes.",,,,@sefr0ly
2025-11-17,19:14:30,Libia,Otros,"La ciencia de Saving Lives  Transfusion Medicine: A Poetic Dive into the World of Blood Transfusions En el ámbito de la medicina, pocos campos son tan complejos y vitales como la medicina de transfusiones. Es un mundo donde la ciencia y el arte entrelazan los hilos de la inmunología, la hematología y la genética, creando un tapiz que se basa en el tejido de nuestra existencia.  [Enlace: https://libyaobserver.ly/cdn-cgi/content?id=nvJC_0Dxd7QOdxwCHj7nXiWFS.0Www.d.PV4Y3Y2Gdg-1763399668.6202466-1.0.1.1-YiJwCCobcOPn9WFqxRRCWyjr4t12NBd4mGo0JdKj6No]",,,,WEB libyaobserver.ly
2025-11-17,19:24:05,Libia,Otros,"Insulator Engineering: The Unsung Heroes of Energy Efficiency  de aislamiento: La ciencia de las barreras térmicas En el ámbito de la ciencia de los materiales, los aisladores desempeñan un papel crucial en la regulación de la transferencia de calor y la eficiencia energética. La ingeniería de aislamiento, un subconjunto de ingeniería de materiales, se centra en el diseño y desarrollo de materiales que minimizan la conductividad térmica, reduciendo así la pérdida o ganancia de calor.  [Enlace: https://libyaobserver.ly/cdn-cgi/content?id=Vlbe8exk41UVkZE4PDK2pplO0CvVkYejafFurhW5yEE-1763400244.4818802-1.0.1.1-n.CF1xDrCARXrYqXnrcO1HWG_iRKp7oiycdbsaa0to0]",,,,WEB libyaobserver.ly
2025-11-17,19:33:52,Libia,Otros,"Ubiquitous Computing: The Invisible Fabric of Modern Life  Computing: The Invisible Fabric of Modern Life A medida que navegamos las complejidades de la vida moderna, es fácil pasar por alto la sutil pero omnipresente fuerza que se esconde sobre las personas, los lugares y las cosas de la computación.  [Enlace: https://libyaobserver.ly/cdn-cgi/content?id=a_HrODRvGZrokhGXgEyAbR57PYyBvnVeezD4UHomED8-1763400831.1958294-1.0.1.1-GPcyiELeXfN.G8td6LjK0DzcvgAKUDdJRDhkNzsWwFc]",,,,WEB libyaobserver.ly
2025-11-17,19:35:56,Libia,Conflicto Armado,"Algunas horas después de los enfrentamientos armados entre las milicias Zubi y Dawi en Warchvana, el Subsecretario del Ministerio de Defensa del Gobierno de Dubba, el Sr. Abdussalam Zubi, celebró una reunión en el Ministerio de Defensa de Trípoli con dirigentes de grupos de apoyo procedentes de Misrata.",,,,@libyabreaking
2025-11-17,19:38:54,Libia,Otros,"- Bensmail añadió en su permiso de transporte “Ataques”, que este incidente era habitual y que el avión había regresado a Alejandría y el equipo de mantenimiento había ido a reparar el fallo. • El Director de la Oficina de Cooperación explicó que se había realizado la última prueba de funcionamiento después de la conservación, y que se esperaba que el avión despegara a Trípoli esta tarde.",,,,@gplusss
2025-11-17,19:43:54,Libia,Otros,"Desbloquear los secretos del lenguaje de expresión Pathology  Unlocking the Secrets of Speech Language Pathology En el ámbito de la comunicación humana, la patología del lenguaje de voz es una disciplina vital, dedicada a la comprensión, el diagnóstico y el tratamiento de los trastornos de comunicación y la rehabilitación.  [Enlace: https://libyaobserver.ly/cdn-cgi/content?id=qf4Xbhf6yvZssgMhKyERV0TuDq2Zqfbf8IR2CG9pSl0-1763401432.5546265-1.0.1.1-JbdSky4CHZcp.X6s8HtmeQeWtD5gBizXVISO5aOkgYU]",,,,WEB libyaobserver.ly
2025-11-17,19:43:56,Libia,Hazards,"Junto con los llamamientos del Consejo Social de Reconciliación a los Cinco para que vigilen a los hijos, los concienticen y se adhieran al libro y al año, una reunión ampliada de la Dirección de Seguridad del Observatorio, en la que participaron funcionarios de la Dirección y la Oficina de Medicina de Emergencias, Apoyo, Gestión de Servicios de Salud y Control de la Educación, a fin de examinar las causas y los motivos del suicidio entre los pequeños grupos suníes, después de que se registrara el quinto caso en la ciudad en tres meses.",,,,@sefr0ly
2025-11-17,19:57:54,Libia,Conflicto Armado,"Fotografía de Abdussalam Zubi, oficial de defensa de Dubai, se reunió hoy con varios comandantes militares de la ciudad de Misrata.",,,,@libyapress
2025-11-17,20:00:54,Libia,Otros,Blumberg: Hannibal Gaddafi se niega a dirigirse a cualquier país árabe y elige su siguiente destino:  [Enlace: https://n9.cl/zizbnh],,,,@gplusss
2025-11-17,20:04:43,Libia,Otros,"Desbloquear los secretos de la Patología del Lenguaje  Desbloquear los secretos de la Patología del Lenguaje En el ámbito de la comunicación humana, la patología del lenguaje se centra en la evaluación, el diagnóstico y el tratamiento de los trastornos de la comunicación y los trastornos de la comunicación.Este fascinante campo se centra en las complejidades de la expresión humana, buscando empoderar a las personas con habilidades de comunicación efectivas.  [Enlace: https://libyaobserver.ly/cdn-cgi/content?id=sqoVWFtq4xS2v8WMybO05SPVmuYgEpSrgUGYE63J2D8-1763402682.1886911-1.0.1.1-LM5wvSrx81gqsV0lSfo9ns_ZSbsdiJnBEaQ5hD7xQ5c]",,,,WEB libyaobserver.ly
2025-11-17,20:14:19,Libia,Otros,"Astronomía: Unveiling the Mysteries of Deep Space  En la vasta extensión del universo, la astronomía ha sido durante mucho tiempo un tema de fascinación, que despierta curiosidad humana y nos lleva a explorar lo desconocido. Al adentrarnos en el espacio de la Tierra, la gravedad es tan intensa que ni siquiera la luz puede escapar.  [Enlace: https://libyaobserver.ly/cdn-cgi/content?id=43qHYzDOjma8XrS9ch4W6J8_.qlfsLzLNaH_j1nreIU-1763403258.4173245-1.0.1.1-0846HTwN3FyLedAEoq7HiYOAA0RwGZ514w_fOw6K8Sk]",,,,WEB libyaobserver.ly
2025-11-17,20:15:56,Libia,Otros,"La oficina del Fiscal General ordena la detención de un ex empleado en el Banco de la República de la República para su toma de 13 millones de dinares, después de haber demostrado su participación en la ocultación de 2 millones de dinares de la suma investigada.",,,,@sefr0ly
2025-11-17,20:16:54,Libia,Otros,"• Como consecuencia de la confiscación de 13 millones de dinares de los fondos del Banco, la Fiscalía Anticorrupción de Trípoli, ex funcionario de la División de Contabilidad de la Administración de las Subdireccións del Banco de la República, se enfrentó a las sustituciones de una fuente de 2 millones de dinares de la cantidad incautada. • Según el Ministerio Público, la Fiscalía ordenó la detención preventiva del acusado en relación con la investigación.",,,,@gplusss
2025-11-17,20:24:11,Libia,Otros,"Etanol Research: Unveiling the Science Behind a Promising Biofuel  Ethanol: A Deep Dive into the World of Biofuels Ethanol, un biocombustible derivado de la biomasa de plantas, ha estado recibiendo una atención significativa en los últimos años debido a su potencial para reducir las emisiones de gases de efecto invernadero y la dependencia de combustibles fósiles.  [Enlace: https://libyaobserver.ly/cdn-cgi/content?id=5I4iKRJck.ZMWuZhgJZzrBSsSHbDm2y6_h07HWyQavQ-1763403849.853267-1.0.1.1-kPMaOp51OEE4w7iOpxb4eeKFAFKONKPGCg8IF9y_LRc]",,,,WEB libyaobserver.ly
2025-11-17,20:25:55,Libia,Otros,"Un avión de carga aterriza hoy en Al-Kufra, procedente del aeropuerto de Boubasso, en Somalia.",,,,@gplusss
2025-11-17,20:27:56,Libia,Criminalidad,• Declaramos que se ha puesto fin a todas las formas de interacción y coordinación con la UNSMIL y que se han revocado los entendimientos financieros o políticos que se han hecho a espaldas del Estado libio. Esta medida constituye una flagrante violación de las atribuciones de la UNSMIL y un ataque directo contra la soberanía libia.,,,,@almasartvlibya
2025-11-17,20:29:56,Libia,Criminalidad,"El General de División 444 del ejército libio puede detener a Hussein Al-Farjani Sassi en Gryan, involucrado en graves casos penales, incluidos robos a mano armada y el asesinato de su hermano en el contexto de una controversia sobre la herencia en 2021, que fue remitida a la Fiscalía General para que completara los procedimientos legales.",,,,@sefr0ly
