fecha,hora,pais,categoria_sicu,descripcion,localizacion,lat,lon,fuente
2025-11-17,13:19:13,Libia,Otros,"Cheminformática: Desbloquear los secretos de las interacciones moleculares  Cheminformática: una sinfonía de los materiales y datos En el ámbito de la quimioinformática, los límites entre la química y los patrones científicos se difuminan, dando lugar a un campo fascinante que busca comprender la intrincados interacciones moleculares.A medida que profundizamos en este mundo cautivador, exploraremos el concepto de la biotecnología, sus aplicaciones y los principios científicos que subyacen a su poder.  [Enlace: https://libyaobserver.ly/cdn-cgi/content?id=hAEifg3ErTKy8v3Ltj9PDQrhjFhwp9p4u87q_.3rd1w-1763378349.6442373-1.0.1.1-PZGgFWAegfenYHskS9eJy_kTSwQ9ic8rTs_sHeNZT3g]",,,,WEB libyaobserver.ly
2025-11-17,13:22:08,Libia,Otros,"El Servicio de Guardacostas del Comando General está rescatando a 69 inmigrantes frente a las costas de Eun-Ghazal, al oeste de la ciudad de Tabruk.",,,,@almasartvlibya
2025-11-17,13:25:18,Libia,Otros,*La economía de la ruta* *Los precios del cemento para el lunes 17 de noviembre de 2025*,,,,@almasartvlibya
2025-11-17,13:27:22,Libia,Otros,*La economía de la ruta* *el precio del día límite para el lunes 17 de noviembre de 2025*,,,,@almasartvlibya
2025-11-17,13:29:17,Libia,Otros,"Diamond Research: Unveiling the Mysteries of the Ancients  Diamond Research: A Journey Through the Age En el ámbito de la ciencia de los materiales, pocas sustancias han cautivado la imaginación humana como diamantes. Durante siglos, estas antiguas gemas han sido objeto de una fascinación geológica, investigación científica y descubrimiento innovador.  [Enlace: https://libyaobserver.ly/cdn-cgi/content?id=12JsVaVnKlLV3jHUYwbqkp2Udu70S2YUs4jm.afJ094-1763378955.3326726-1.0.1.1-JqBnNqGoDWZkcXrrVl.jvOFC3RgK48dIFs2qSEOK1QM]",,,,WEB libyaobserver.ly
2025-11-17,13:30:38,Libia,Otros,"Los detenidos que se niegan a regresar voluntariamente al país - CBS - CBS - CBS=Gplluss.com/2025/11/17/%d8a%aa%d8%d8%d8%d8%d8%d8%b1%d9%d9%d8%d8%d8%d8%d8%d8%d8%d8%d8%d8%d8%d8%d8%d8%d8%d8%d8%d8%d8%d8%dd8%d8%d8%dd8%d8%d8%d%d8%d%d8%d%d8%d%dd8%d%d%d. En el caso de los inmigrantes en cuestión, la OLP en el caso de los inmigrantes no inscritos en la OLP, o en el caso de los inmigrantes en cuestión de inmigración, en el caso de que los inmigrantes en cuestión de asilos en Libia, en el caso de que los inmigrantes en cuestión han sido rechazados en el caso de que el caso de que los inmigrantes en cu...  [Enlace: https://gplusss.com/2025/11/17/%d8%ae%d8%a8%d9%8a%d8%b1-%d9%82%d8%a7%d9%86%d9%88%d9%86%d9%8a-%d9%8a%d8%b7%d8%a7%d9%84%d8%a8-%d8%a8%d9%85%d8%ad%d8%a7%d9%83%d9%85%d8%a9-%d9%88%d8%aa%d8%b1%d8%ad%d9%8a%d9%84-%d8%a7%d9%84%d9%85%d9%87/]",,,,WEB gplusss.com
2025-11-17,13:32:07,Libia,Otros,*La economía de la ruta* *el precio del pescado para el lunes 17 de noviembre en los mercados minoristas de Trípoli*,,,,@almasartvlibya
2025-11-17,13:32:07,Libia,Criminalidad,"– No debe alterarse el tipo de cambio del dinar libio por lo menos de dos a tres años para mantener su estabilidad y hacer más esfuerzos para restablecer la confianza en el sector bancario y en el dinar libio. – Se necesita una regulación inmediata del gasto de los gobiernos, una mayor transparencia, un aumento del rendimiento del banco central y una mayor transparencia general del sector bancario para reducir la especulación y la delincuencia transfronteriza.",,,,@libyapress
2025-11-17,13:35:08,Libia,Otros,"*La economía de la ruta, los tipos de cambio de divisas frente a los dinares en el Banco Central de Libia el lunes 17 de noviembre de 2025.",,,,@almasartvlibya
2025-11-17,16:20:09,Libia,Otros,Reunión ampliada en el municipio de Zintan para examinar los problemas del sector de la educación,,,,@almasartvlibya
2025-11-17,16:20:10,Libia,Otros,"Los precios del cemento de la Federación se han estabilizado por tercer día consecutivo, el lunes, en las tiendas al por menor de Trípoli, según la vigilancia sobre el terreno del Grupo de Economía de la Ruta. Desde el sábado pasado, el precio de un cántaro de cemento de la Federación se ha mantenido entre 61 y 62 dinares.",,,,@almasartvlibya
2025-11-17,16:20:10,Libia,Otros,Nuestras noticias son una investigación en la que se investigan las causas profundas de la creciente violencia contra los escolares en Libia.,,,,@almasartvlibya
2025-11-17,16:20:10,Libia,Otros,"# Nuestras noticias # Abogada Farah Al-Jalani: Según la ley, ningún profesor que no conozca los orígenes de la educación debe ser designado como televisión de la ruta de la frecuencia: HD: H11373",,,,@almasartvlibya
2025-11-17,16:20:10,Libia,Otros,Hace dos años hicimos un estudio que demostró la prevalencia de la violencia en las escuelas.,,,,@almasartvlibya
2025-11-17,16:20:10,Libia,Terrorismo,*Noticias * Miembro de la Sociedad Libia de Psicología Abdul Qadir Shibo: la falta de estudios de pedagogía entre los nuevos maestros contribuyó a la violencia escolar.,,,,@almasartvlibya
2025-11-17,16:20:10,Libia,Hazards,*Noticias * Directora del Departamento de Servicios Sociales y Salud Mental Fawzia Bin Ghashir: Los problemas familiares se transmiten a la escuela y se reflejan en el comportamiento del niño.,,,,@almasartvlibya
2025-11-17,16:20:10,Libia,Otros,"Representante del Gobierno de Qatar, Embajador de Libia en la firma de un acuerdo para financiar la aplicación de la hoja de ruta de las Naciones Unidas con la Representante Residente del PNUD.",,,,@almasartvlibya
2025-11-17,16:20:10,Libia,Otros,¶ 40 empresas mundiales que compiten en una ronda de licitaciones para la exploración de petróleo en Libia son las primeras desde 2008 en la televisión de la ruta de la frecuencia: HD: H11373,,,,@almasartvlibya
2025-11-17,16:20:10,Libia,Otros,Los concejales de los Municipios elegen a los alcaldes de sus municipios.,,,,@almasartvlibya
2025-11-17,16:20:10,Libia,Otros,Tercer boletín de noticias de la televisión de la ruta: Apoyo egipcio a los esfuerzos por formar un nuevo gobierno en Libia  [Enlace: https://youtube.com/live/Wd8ISCSwYUA],,,,@almasartvlibya
2025-11-17,16:20:10,Libia,Otros,"La palabra del comandante mariscal, sucesora de Hafter, durante su encuentro con ancianos, ojos y sabios de las tribus de las regiones del Sahel-Occidente.",,,,@almasartvlibya
2025-11-17,16:20:10,Libia,Otros,El dólar de los EE.UU. siguió aumentando frente al dinar en el mercado paralelo hoy el lunes.,,,,@almasartvlibya
2025-11-17,16:20:10,Libia,Otros,# Reflexionar sobre la evolución política con el periodista # Mahoma_Bayo a las 10:00 p.m.,,,,@almasartvlibya
2025-11-17,16:20:10,Libia,Otros,"El Presidente del Gobierno de Libia decide establecer el Servicio de Protección del Niño y la Mujer para garantizar una protección eficaz y urgente a todas las mujeres y niños que sean víctimas de violencia, amenazas o explotación.",,,,@almasartvlibya
2025-11-17,16:20:10,Libia,Otros,*[La economía del camino] ¿Cómo se agravó la crisis de liquidez en la segunda mitad de 2025?,,,,@almasartvlibya
2025-11-17,16:20:10,Libia,Otros,La solución de la crisis está en una decisión popular que pone fin a las rutas de manipulación.,,,,@almasartvlibya
2025-11-17,16:20:10,Libia,Otros,Marshal Hafter: Los usuarios de la corrupción del Estado están inventando argumentos para mantener la televisión de la ruta de frecuencia: horizontal HD:,,,,@almasartvlibya
2025-11-17,16:20:10,Libia,Otros,"El misionero Hafter: El pueblo libio es todo un hermano en lo bueno y en lo malo, sin distinción entre las circunstancias, por mucho que se aprecien y se agraven, sino que más bien aumenta la cohesión de la televisión de la ruta de la frecuencia:",,,,@almasartvlibya
2025-11-17,16:20:10,Libia,Otros,"Mashakh y Aayan, tribus de la costa occidental, aseguran al Mariscal Hafter que están dispuestos a desempeñar un papel activo en pro de la unidad y estabilidad de Libia.",,,,@almasartvlibya
2025-11-17,16:20:10,Libia,Otros,"Los que se encuentran en el trono del poder están ocupados por conflictos y luchas entre ellos, inventando argumentos para que el panorama permanezca inmóvil . La corrupción se ha convertido en un fenómeno común en las instituciones del Estado y las armas de todo tipo se extienden fuera de su control, amenazando la seguridad y la protección de los ciudadanos inocentes .",,,,@almasartvlibya
2025-11-17,16:20:10,Libia,Otros,"• En apoyo del proyecto conjunto “Apoyo al diálogo político y fortalecimiento de la participación cívica”, Qatar ha firmado un acuerdo de financiación y apoyo a la hoja de ruta de las Naciones Unidas para la solución de la crisis en Libia. • Según una declaración de la misión, el acuerdo ha sido firmado por el Embajador de Qatar ante Libia, Khaled Al-Dousari, Representante Residente del Programa de las Naciones Unidas para el Desarrollo (PNUD), Dra.",,,,@gplusss
2025-11-17,16:20:10,Libia,Otros,"- La Comisión ha confirmado que las tarjetas se distribuirán en los días siguientes a esa fecha (el martes, el miércoles y el jueves) del 20 al 18 de noviembre, de las 8.00 a las 16.00 horas. - La Comisión ha dejado claro que el jueves 20 de noviembre de 2025 es la fecha límite para la recepción de la tarjeta (elector), y que no habrá prórrogas después de esa fecha.",,,,@gplusss
2025-11-17,16:20:10,Libia,Otros,"• El tipo de cambio del dólar se registró en Trípoli en 7,89 dinares, 7,86 en Benghazi y 7,895 en Zelton, según las cifras sobre transacciones en el mercado negro.",,,,@gplusss
2025-11-17,16:20:10,Libia,Otros,Sharif: Bancos comerciales de Libia. La división libera el desgaste económico en  %a7%d9%d8%d8%b8%b1%d9%d9%d9%d9%d8%d9%d9%d9%d9%d8%d8%d8%d8%d8%d8%d8%d9%d8%d9%d8%d8%d9%d9%d9%d8a%d8a%d8a%d8%d8a%d8%%d8a%d8%%d8a%d8%%d8%d8%%dov%d8a%d8%dov%d8%d8%dov%d8%dov%d8%dov%d8%%d8%%%d9%a-%d9%8%d8%8%%d8%d8a-%d8%d8%%8%%d8%%d8%%8%d8%%%%%dokd9%d9%%dov9%d8%dov9%d8%8%d8%d8%%%%dov%8%dovd8%8%%%%%8%8%8%dovd8%8%%%%%d%d8%d8%dov%%%%%%%dovk%d8%%%d%d8%dok%d%d8%d%%%%%%%kd%d%d%d%d%d%k%%k%d%dk%dk%d%dk%dk%%d8%d8%d8%d%d8%d%d8%dok%d%%%%d%d%d%d%d%d%%%%%%%k%d%d%dk%dk%dk%dk%d%%%%%%%%%%%%%%%%%%%%%%%%%%%%  [Enlace: https://gplusss.com/2025/11/17/%d8%a7%d9%84%d8%b4%d8%b1%d9%8a%d9%81-%d8%a7%d9%84%d9%85%d8%b5%d8%a7%d8%b1%d9%81-%d8%a7%d9%84%d8%aa%d8%ac%d8%a7%d8%b1%d9%8a%d8%a9-%d8%a8%d9%8a%d8%aa-%d8%a7%d9%84%d8%af%d8%a7%d8%a1-%d9%81%d9%8a-%d9%84/],,,,@gplusss
2025-11-17,16:20:10,Libia,Otros,"• Ayer, Mohamed Al-Houij, Ministro de Economía del Gobierno de Dubai, se reunió con la Enviada Adjunta de las Naciones Unidas para examinar las perspectivas económicas de Libia y los planes de diversificación. • Según una declaración de la misión, las dos partes examinaron los medios de promover las reformas económicas y ampliar las oportunidades de colaboración entre los sectores público y privado.",,,,@gplusss
2025-11-17,16:20:10,Libia,Otros,"- Dos aviones de carga de los Emiratos Árabes Unidos que salen del aeropuerto somalí de Bossaso. - Dos aviones de carga IL-76TD de los Emiratos Árabes Unidos, dirigidos por Fly Sky Airlines (EX-76017 y EX-76018), que salen del aeropuerto de Al-Kufra, en el este de Libia.",,,,@gplusss
2025-11-17,16:20:10,Libia,Criminalidad,"• La institución consideró que el incidente constituía una grave violación de los derechos humanos y del estado de derecho y de la justicia, y que constituía un delito de ocultación forzada. • La institución reiteró que todas las detenciones y encarcelamientos debían basarse en los fundamentos y las normas jurídicas, de conformidad con las obligaciones internacionales y jurídicas de Libia.",,,,@gplusss
2025-11-17,16:20:10,Libia,Terrorismo,"Transferencias en millones de dólares, documentos que revelan graves irregularidades en la administración de la antigua Sociedad Islámica.  [Enlace: https://h1.nu/1jvP5]",,,,@gplusss
2025-11-17,16:20:10,Libia,Hazards,La salud de los diputados exige que se investigue el desorden de los comités especiales: muchos pacientes murieron en Libia.  [Enlace: https://h1.nu/1jvUs],,,,@gplusss
2025-11-17,16:20:10,Libia,Otros,"Después del plan de asentamiento de los inmigrantes en Libia, los llamamientos populares a favor de que se facilite el tránsito de los inmigrantes hacia Italia se intensifican hasta que la Convención sea derogada por completo.",,,,@jraimalmlyshyat
2025-11-17,16:20:10,Libia,Otros,"Un vídeo documenta el momento en que el Mayor Ahmed Abdul Karim Abdalmouli trató de ser secuestrado por dos personas en la zona de Al-Harasheh. Después de resistirse a los atacantes, le dispararon antes de huir.",,,,@jraimalmlyshyat
2025-11-17,16:20:11,Libia,Otros,"• El Embajador de Qatar en Libia, en su calidad de representante del Gobierno de Qatar, firmó un acuerdo con la Representante Residente del Programa de las Naciones Unidas para el Desarrollo (PNUD) sobre la financiación de la aplicación de la hoja de ruta de las Naciones Unidas para la vía política en Libia. La firma de la Convención ha planteado interrogantes en los círculos locales sobre el papel de Qatar en un expediente que es exclusivamente libio, afirmando que la preparación y aplicación de la hoja de ruta deben realizarse a través de los propios libios sin injerencias externas.",,,,@libyabreaking
2025-11-17,16:20:11,Libia,Otros,"La Misión de las Naciones Unidas está firmando un acuerdo de financiación por el Gobierno de Qatar para apoyar el diálogo político y promover la participación cívica. – El acuerdo fue firmado por el Embajador Khaled Al-Dousari y la Representante Residente del PNUD, Sophie Kemkereh.",,,,@libyapress
2025-11-17,16:20:11,Libia,Terrorismo,"- Los fondos salieron de ""Libia a través del banco exterior"", Al-Khoja, Al-Khaji y Ali Djail, en calidad de ex departamentos, durante años, para realizar transferencias financieras a centros que no pertenecían a la Sociedad. - Se celebró una reunión ilegal en coordinación con miembros de la comunidad iraquí que controlaban el centro, con el fin de aprobar un proyecto de demolición y construcción por valor de 3 millones de euros, y se manipuló la documentación para legalizarlo.",,,,@libyapress
2025-11-17,16:20:11,Libia,Otros,"Miembro de la Cámara de Representantes de los Arrecifes, Qatar se hará cargo de los gastos de la conversación política libia, el financiador tiene todas las herramientas.",,,,@libyapress
2025-11-17,16:20:11,Libia,Criminalidad,"La institución nacional de derechos humanos de Libia, en una declaración, condena la detención de un miembro del personal del Ministerio de Justicia y de los órganos judiciales por el Servicio de Seguridad Interna de la ciudad de Benghazi, en el contexto de su participación en la exigencia de que se aplique la Ley de salarios. La declaración: este hecho constituye una violación grave de los derechos humanos, el estado de derecho y la justicia, es contrario a la legislación vigente y constituye un delito de abuso de poder.",,,,@libyapress
2025-11-17,16:20:11,Libia,Otros,"– No hay mecanismos claros ni criterios transparentes para regular el tratamiento en el país o en el extranjero, lo que hace que el ciudadano sea víctima de un desorden administrativo y de órganos impotentes que no reconocen ni las prioridades de los casos ni su sufrimiento. – Exigimos que el ministerio público y los órganos de supervisión abran una investigación urgente y exhaustiva de estas violaciones administrativas, financieras y humanitarias dentro de los organismos responsables, principalmente el de desarrollo de los servicios de tratamiento, y que rindan cuentas a quienes causan la...",,,,@libyapress
2025-11-17,16:20:11,Libia,Otros,"La Embajada Libia en Ammán señala a los libios que desean viajar a Jordania que es necesario localizar la residencia en un plazo máximo de dos semanas a partir de la llegada, para evitar una multa de 200 dinares jordanos, lo que equivale a 280 dólares, como la Embajada de Jordania ha reconocido a los infractores.",,,,@sefr0ly
2025-11-17,16:20:11,Libia,Otros,"El sitio técnico de Tech Spot revela la intención de Google de imponer sanciones a las aplicaciones que consumen una batería de androide de forma intensiva sin motivos que consideren ""más convincentes"" para ese consumo, al tiempo que modifican las normas de control de la batería en los teléfonos.",,,,@sefr0ly
2025-11-17,16:20:11,Libia,Otros,"Con la bendición de la Enviada de las Naciones Unidas, Hannah ""Tete"", el Embajador de Qatar, Khaled Aldousri, y la representante del Programa de las Naciones Unidas para el Desarrollo (PNUD), Sophie Kemkedze, están firmando en Trípoli un acuerdo de financiación del Gobierno de Qatar para apoyar el proyecto de apoyo al diálogo político y la promoción de la participación cívica, que contribuirá a fortalecer los esfuerzos para aplicar la hoja de ruta de las Naciones Unidas.",,,,@sefr0ly
2025-11-17,16:20:11,Libia,Otros,"Después de revelar la presencia de un luchador colombiano en el campo de la paz en la plataforma de investigación de la ICAD, el mercenario colombiano Jorge Luis Sylvestre Ardilla ha borrado sus cuentas en las redes sociales, durante las cuales ha publicado imágenes documentadas de su presencia en el Kufra, entre las pruebas de un creciente número de mercenarios colombianos contratados por los Emiratos Árabes Unidos para luchar por su aliado Hammeti, y ha participado en el sitio de los Fashir y su reciente caída.",,,,@sefr0ly
2025-11-17,16:20:11,Libia,Otros,"Algunos grandes mercados de la capital están llevando a cabo una campaña de boicot para las empresas que sólo manejan dinero en efectivo, así como otros que fijan un precio diferente para las mercancías utilizando giros bancarios.",,,,@sefr0ly
2025-11-17,16:28:40,Libia,Otros,"Diamond Research: Unveiling the Mysteries of the Ancients  Diamond Research: A Journey Through the Age En el ámbito de la ciencia de los materiales, pocas sustancias han cautivado la imaginación humana como los diamantes. Durante siglos, estas antiguas gemas han sido objeto de una fascinación, investigación científica y descubrimiento innovador de las células.  [Enlace: https://libyaobserver.ly/cdn-cgi/content?id=aGIlVkX6lDxHfGbHgmN2BNs8Ja30s4TApjAAub09T2Y-1763389719.0383852-1.0.1.1-SHkjJLXsIJLKIPxc.R88jursGj6z3e3VLJtBB9Un3XI]",,,,WEB libyaobserver.ly
2025-11-17,16:29:28,Libia,Otros,"La oposición de la Misión y la prohibición de la circulación -CBS  En la actualidad, la OCS (CS) (Apoyo a todos los partidos políticos %%8%d8%d8a%d9%d9%d8%d8%d8a%d8%d8%d8%d8%d8%d8%d8%d8%d8%d8%d8a. En el caso de la OSC, la OSC (CS), la OSLC (CG) (CGS) (Apoyo a todos los diputados) (Apoyo a la OS) (Apoyo a la OS) (Apoyo a la OS) (CLC)) (Apoyo a la OS) (C)  [Enlace: https://gplusss.com/2025/11/17/%d8%a7%d9%84%d9%86%d9%88%d8%a7%d8%a8-%d9%8a%d8%aa%d9%85%d8%b3%d9%83-%d8%a8%d9%80-%d8%aa%d8%ba%d9%8a%d9%8a%d8%b1-%d8%b4%d8%a7%d9%85%d9%84-%d9%84%d9%84%d9%85%d9%86%d8%a7%d8%b5%d8%a8-%d8%a7%d9%84%d8%b3/]",,,,WEB gplusss.com
2025-11-17,16:32:30,Libia,Otros,"Después de que el dólar llegara a 7,90, los medios de comunicación Khalil al-Hassi reflejan una lucha devastadora por el dinero y el poder.",,,,@gplusss
2025-11-17,16:36:08,Libia,Otros,"Astronomía: Unveiling the Mysteries of Deep Space  En la vasta expansión del universo, la astronomía ha sido durante mucho tiempo un tema de fascinación, generando curiosidad humana e impulsando el estudio de los agujeros negros, regiones del espacio donde la gravedad es tan intensa que ni siquiera la luz puede escapar.  [Enlace: https://libyaobserver.ly/cdn-cgi/content?id=ulsThu9m__qMJ5MxohZAKt0tdQNL82mPQueP.kqsnDA-1763390167.5296173-1.0.1.1-grq69_j5fjSv5B3NWzBlL0F3T70.f0JAicgaoN4QOro]",,,,WEB libyaobserver.ly
2025-11-17,16:39:39,Libia,Terrorismo,"Bioarchaeology: Unveiling the Secrets of the Past  Bioarchaeology, un subcampo de arqueología, es un enfoque interdisciplinario que combina el estudio de los restos humanos con el contexto arqueológico para reconstruir las vidas de las sociedades pasadas. Este fascinante campo ha revolucionado nuestra comprensión de la historia humana, arrojando luz sobre la dieta, la salud y el estilo de vida de las culturas antiguas.  [Enlace: https://libyaobserver.ly/cdn-cgi/content?id=ZFeY1jKF1RfnCR_JNAeRz71iw6FEdrGI8UU7_YvtnFc-1763390377.003479-1.0.1.1-05sOwVuL4bbaKZ97inriwg7qReFIWqI3KMH7kdiNGiA]",,,,WEB libyaobserver.ly
2025-11-17,16:40:31,Libia,Otros,"La Fundación Visión de la Ciencia Espacial espera que pronto llegue una ola fría en las regiones occidentales de Libia, especialmente en el norte-occidental, comenzando por el próximo sábado, con una disminución de la temperatura, acercándose a cero centígrados en las alturas de la montaña occidental y el Ramad Rojo.",,,,@sefr0ly
2025-11-17,16:45:31,Libia,Criminalidad,"*Libia figura entre los países más altos del mundo en la tasa de delincuencia. *Libia ocupa el tercer lugar en el mundo árabe y 36 en la tasa de delincuencia a mediados del año 2025, con un índice de delincuencia de 56,4 y un índice de seguridad de 43,6 según el índice de delincuencia de Numbeo, que se especializa en reunir y analizar datos sobre la calidad de vida.",,,,@libyabreaking
2025-11-17,16:46:22,Libia,Otros,"Genomic Imprinting: The Epigenetic Enigma  Genomic Imprinting: Unveiling the Mysteries of Parental Gene Expresion Deep in the laberineine traditions of genetrice, un fascinante fenómeno que se mantiene en el campo de la genealogía genómica.  [Enlace: https://libyaobserver.ly/cdn-cgi/content?id=6FFRZ75sahs47qTJjzFfjXCQD2NEMQ6JYwcuHSN7orE-1763390780.6850748-1.0.1.1-30s7O_T37Yf8v07.H2NoDfUoKZp6dDdwr3kF556.2wg]",,,,WEB libyaobserver.ly
2025-11-17,16:46:30,Libia,Hazards,":: La Comisión de Salud de la Cámara de Representantes pide al `Vicepresidenta General y a los órganos de supervisión que investiguen las violaciones administrativas, financieras y humanitarias cometidas en el interior de los servicios médicos, en particular el dispositivo de desarrollo de los servicios terapéuticos de  de la Unidad de Televisión de Vía de Frecuencia: HD: H11373",,,,@almasartvlibya
2025-11-17,16:48:30,Libia,Otros,El gobierno de Hamad ha establecido un mecanismo de vigilancia para proteger a los niños y las mujeres.,,,,@gplusss
2025-11-17,17:01:31,Libia,Otros,Los arrecifes sobre la financiación de Qatar para el diálogo político libio son humillantes.,,,,@gplusss
2025-11-17,17:01:31,Libia,Otros,"- El análisis periodístico se basó en una foto publicada por un tal Jorge Luis Sylvestre Ardilla en los mapas de Google, en la que señaló su presencia en una base de seguimiento del batallón libio de “Slave Peace” -el batallón de “Slave por la Paz” vinculado a las Fuerzas de Apoyo Rápido, con el que participó en las batallas del Triángulo Fronterizo. -A través de la fotografía publicada por Jorge, pudimos localizar su posición en el batallón, llegar a sus cuentas en las plataformas de comunicación y descubrir que era un ex soldado del ejército colombiano.",,,,@libyapress
2025-11-17,17:03:14,Libia,Otros,"Perforación ingeniería: The Science of Borehole Optimization  Drilling Engineering: The Science of Borehole Optimization Drilling engineering es un campo multidisciplinar que implica la aplicación de los principios matemáticos y científicos para optimizar el proceso de perforación. En su núcleo, la ingeniería de perforación tiene como objetivo minimizar los costos, reducir el impacto ambiental y maximizar la eficiencia de la construcción de pozos.  [Enlace: https://libyaobserver.ly/cdn-cgi/content?id=KXHo7pLakS8OlTUWK5ds0BdMcDTH49ZYlB2SLo6aXs0-1763391792.2469487-1.0.1.1-ppOhu_Zo1dtWzrQhffZfm6hYGiQNmCmiSAEbYtECQK4]",,,,WEB libyaobserver.ly
2025-11-17,17:06:50,Libia,Otros,"Diamond Research: Unveiling the Mysteries of the Ancients  Diamond Research: Un viaje a través de la ciencia de los materiales, pocas sustancias han cautivado la imaginación humana como los diamantes. Durante siglos, estas antiguas gemas han sido un tema de estudio científico y descubrimiento innovador de la gema.  [Enlace: https://libyaobserver.ly/cdn-cgi/content?id=nUAq42Eb46HEFy5KQN4Kywz_09k.gYyppHLQ2tOee4o-1763392009.4289117-1.0.1.1-gaoH8sQ9YpSgMMwSypWvCmyWz7Bi8CUXq85DUgCfi60]",,,,WEB libyaobserver.ly
2025-11-17,17:10:31,Libia,Otros,"Después de que la mayoría de los sectores hayan recibido sus salarios, el Fondo de Solidaridad Social anuncia que el Banco Central de Pensiones de octubre 2025 será transferido a la cuenta del Organismo durante el fin de la jornada, los dos, prometiendo que las pensiones se depositarán en las cuentas de los beneficiarios mañana el martes, diciendo que la demora que ha tenido lugar está fuera de la voluntad de la administración del Organismo.",,,,@sefr0ly
2025-11-17,17:15:30,Libia,Otros,"# La economía de la ruta # # el precio de la moneda encriptada # # Bitcoin a 93,8 mil dólares, ¿cuánto es en dinares libios? #",,,,@almasartvlibya
2025-11-17,17:16:18,Libia,Otros,"Capacidades de almacenamiento de discos: Unveiling the Mechanics of Data Persistence  Disk Storage: The Foundation of Modern Computing es un componente fundamental que ha revolucionado la forma en que almacenamos y accedemos a los datos: almacenamiento de discos, almacenamiento de discos, tecnología ubicuo ha experimentado importantes transformaciones desde su inicio, con innovaciones continuas que continúan ampliando los límites de capacidad, velocidad y fiabilidad.  [Enlace: https://libyaobserver.ly/cdn-cgi/content?id=_rwOzlHbD9HW_RChtm5ddRXpK8Y6Vz.k0HcNWNUX_Gc-1763392577.1589403-1.0.1.1-gfSyARadRHS2BYeaqe3KzBAdZr5UBTJGWBtN_ij5HV4]",,,,WEB libyaobserver.ly
2025-11-17,17:19:30,Libia,Otros,Fondo Monetario Internacional (FMI): La división política de Libia domina el panorama económico y el presupuesto unificado es el camino hacia la supervivencia,,,,@almasartvlibya
