fecha,hora,pais,categoria_sicu,descripcion,localizacion,lat,lon,fuente
2025-11-17,20:31:55,Libia,Otros,"El dólar de los EE.UU. siguió aumentando frente al dinar al final de las transacciones del lunes, con 7,94 dinares registrados en el mercado de las monedas de Trípoli, 7,91 dinares en el mercado de Venecia (Benghazi) y 7,93 dinares en el mercado de Zelton, mientras que el dólar se estabilizó a nivel de las transacciones de instrumentos, con 9,24 dinares en la televisión de la ruta de frecuencia: horizontal HD: H11373",,,,@almasartvlibya
2025-11-17,20:32:56,Libia,Otros,"Mohamed Boiser, ex asesor político de la sucesión de Hafeter, que no promovió la participación de Hafeter en la guerra de octubre: si no puedes mentir todo lo que quieras, Hafir no fue disparado ni en octubre de 1973 ni en la zona del Canal.",,,,@libyapress
2025-11-17,21:15:25,Libia,Otros,"Agricultural Economics: The Hidden Patterns  Agricultural Economics: Unveiling the Intriacies En el ámbito de la economía agrícola, se espera un mundo de patrones intrincados y equilibrios delicados.A medida que ahondamos en este fascinante campo, encontramos que la tierra que mantiene la fertilidad del suelo y la demanda, influenciada por factores como el clima, la tecnología y la política, puede tener impactos de gran alcance sobre la productividad agrícola y la sostenibilidad ambiental.  [Enlace: https://libyaobserver.ly/cdn-cgi/content?id=135d1obY50wVTlsNaudGHWBuCxYKW7yJddIvVzwRPc8-1763406921.6810658-1.0.1.1-cS9i6CLnQ14EKGa54FKsQf2xwPlHzTEh8k0ncBHJQHc]",,,,WEB libyaobserver.ly
2025-11-17,21:24:32,Libia,Otros,"En las áreas de tecnología, tecnología, tecnología, tecnología, tecnología, tecnología, tecnología, tecnología, tecnología, tecnología, tecnología, tecnología, tecnología, tecnología, tecnología, tecnología, tecnología, tecnología, tecnología, tecnología, tecnología, tecnología, tecnología, tecnología, tecnología, tecnología, tecnología, tecnología, tecnología, tecnología, tecnología, tecnología, tecnología, tecnología, tecnología, tecnología, tecnología, tecnología, tecnología, tecnología, tecnología, tecnología, tecnología, tecnología, tecnología, tecnología, tecnología, tecnología, tecno...  [Enlace: https://libyaobserver.ly/cdn-cgi/content?id=kbW.2lgoLZCDE5eltITIwZdZKPzukrVucKC0KbZBRbM-1763407471.6657321-1.0.1.1-Cq4BM2F7W60hq.fhJ3Mjq4UvZQjvxIaBslZjAxqSVIk]",,,,WEB libyaobserver.ly
2025-11-17,21:34:35,Libia,Otros,"Volcanología: Unveiling the Secrets of Earth's Fiery Profundities  Volcanología: Un viaje al corazón del fuego Profundo dentro de la corteza terrestre, un caldero de rocas fundidas y minerales simmers, esperando a desencadenar su furia sobre la superficie. Volcanología, el estudio científico de volcanes, busca entender los procesos complejos que rigen estas maravillas geológicas.Al profundizar en el mundo de la volcanología, nos encontramos con el aumento de las temperaturas, la concentración de la capa de ozono, la capa de ozono y la capa de ozono.  [Enlace: https://libyaobserver.ly/cdn-cgi/content?id=qpjvX_ZNXcSBi0nJ2CcAK8q16BRbaSdFx.LAzPEye60-1763408072.913618-1.0.1.1-PBJq.Bre9_dFRFLU5Db9WOMbng0OFC6qRKoZC1ISgB4]",,,,WEB libyaobserver.ly
2025-11-17,22:13:42,Libia,Otros,"Activity: A Journey Through the Realm of Movement  En el gran tapiz de la existencia humana, la actividad física es un hilo vital que entrelaza el tejido de nuestras vidas. Al igual que una brisa suave en un día de verano, nos entrelazamos con la armonía de la mente, despertar los sentidos y revitalizar el espíritu.  [Enlace: https://libyaobserver.ly/cdn-cgi/content?id=hISHsgYpJcBN78rzmypwEDEDwlR6TaPKJUz_XHhprYA-1763410420.8322237-1.0.1.1-ZlBzXScHHGXZXUv3tQFG2znSpQ.Uszhj5z0pVDIwZl4]",,,,WEB libyaobserver.ly
2025-11-17,22:13:46,Libia,Otros,"Plataforma libia - Gobierno de Libia: La Misión es plenamente responsable de socavar la confianza, socavar el proceso político y desaprovechar las oportunidades de lograr una verdadera trayectoria nacional.  [Enlace: https://almenassa.ly/2025/11/17/%d8%a7%d9%84%d8%ad%d9%83%d9%88%d9%85%d8%a9-%d8%a7%d9%84%d9%84%d9%8a%d8%a8%d9%8a%d8%a9-%d9%86%d8%ad%d9%85%d9%84-%d8%a7%d9%84%d8%a8%d8%b9%d8%ab%d8%a9%d9%8e-%d8%a7%d9%84%d9%85%d8%b3%d8%a4%d9%88%d9%84/]",,,,WEB almenassa.ly
2025-11-17,22:13:47,Libia,Otros,Plataforma libia - Gobierno de Libia: Proclamamos la cesación de todas las formas de interacción y coordinación con la UNSMIL hasta que se haya retractado completamente de este comportamiento y se haya presentado una disculpa oficial en  [Enlace: https://almenassa.ly/2025/11/17/%d8%a7%d9%84%d8%ad%d9%83%d9%88%d9%85%d8%a9-%d8%a7%d9%84%d9%84%d9%8a%d8%a8%d9%8a%d8%a9-%d9%86%d8%b9%d9%84%d9%86-%d8%a5%d9%8a%d9%82%d8%a7%d9%81-%d9%83%d8%a7%d9%81%d8%a9-%d8%a3%d8%b4%d9%83%d8%a7%d9%84/],,,,WEB almenassa.ly
2025-11-17,22:19:23,Libia,Otros,"* # La economía de la calle # El oro roto de 18 ha terminado las transacciones de mercado paralelas de hoy, el lunes, a 759 dinares por gramo, a pesar de que a veces los niveles de 760 dinares han aumentado de manera limitada, mientras que el precio del gramo de oro roto de 21 dólares al final de las transacciones de hoy se ha registrado a 885 dinares por gramo, según la vigilancia del movimiento del mercado por el equipo de economía de ruta.",,,,@almasartvlibya
2025-11-17,22:19:23,Libia,Otros,El Gobierno de Libia condena la financiación de Qatar para el diálogo de la Misión de las Naciones Unidas en la Jamahiriya Árabe Libia (UNMIBH) y el Fondo Monetario Internacional (FMI) pide que se apruebe un presupuesto unificado en Libia (  [Enlace: https://youtube.com/live/A7F6FkGXuPY],,,,@almasartvlibya
2025-11-17,22:19:23,Libia,Otros,• El Ministerio Público ordena la detención de un ex empleado del Banco de la República por su participación en la camuflación de una fuente de “dos millones de dinares” en el caso de la toma de “13 millones”.,,,,@almasartvlibya
2025-11-17,22:19:23,Libia,Otros,"∙ Los dignatarios, ancianos y ancianos de las tribus de la costa occidental visitan la sede de la Cámara de Representantes y la biblioteca parlamentaria de la ciudad de Benghazi, y visitan la pared de imágenes históricas y la biblioteca electrónica con fuentes y documentos digitales.",,,,@almasartvlibya
2025-11-17,22:19:23,Libia,Otros,∙ Noticias de la ruta de la televisión de la ruta de la frecuencia: horizontal HD: H11373,,,,@almasartvlibya
2025-11-17,22:19:23,Libia,Otros,"Los residentes se sintieron claramente abrumados, en medio de un estado de pánico.",,,,@almasartvlibya
2025-11-17,22:19:23,Libia,Otros,Cualquier financiación externa de la UNSMIL debe respetar la soberanía libia y no transformar el proceso político en una nueva influencia regional. Esta medida se evalúa con cautela y nos preguntamos cómo se puede utilizar esa financiación en Libia.,,,,@almasartvlibya
2025-11-17,22:19:24,Libia,Criminalidad,"• En una declaración, el Gobierno afirmó que la búsqueda por la UNSMIL de financiación externa de operaciones políticas dentro de Libia, sin consultar ni notificar a ninguna parte oficial libia, constituye una violación flagrante de las costumbres diplomáticas y pone de manifiesto un enfoque totalmente sospechoso y sospechoso que es contrario a la naturaleza de su supuesta función y suscita serias dudas acerca de sus verdaderas intenciones. • El Gobierno de Hamad pidió al Secretario General de las Naciones Unidas, Antonio Guterres, que asumiera la responsabilidad jurídica y moral de las acc...",,,,@gplusss
2025-11-17,22:19:24,Libia,Otros,"• La misión tiene por objeto garantizar, mediante esta plataforma digital, la participación del mayor número posible de jóvenes libios residentes en Libia, de 18 a 35 años de edad, que deseen participar en el diálogo estructurado. • La plataforma digital ofrece a los participantes la oportunidad de expresar sus opiniones y puntos de vista sobre las cuestiones fundamentales que se debaten en el diálogo y de participar en el diálogo con los jóvenes que son miembros del diálogo estructurado, asegurando así que se escuchen las voces de los jóvenes de todo el país en el proceso político.",,,,@gplusss
2025-11-17,22:19:24,Libia,Otros,"• Según la declaración de la misión, la reunión se celebra en el marco de la serie ampliada de consultas de la UNSMIL, el próximo martes a las 18.00 horas, hora local, a través de la aplicación de Zoom Zoom. • La misión indicó que las personas que deseaban participar podían inscribirse aquí:  [Enlace: https://forms.office.com/e/SjamFCb1P8]",,,,@gplusss
2025-11-17,22:19:24,Libia,Otros,"• Según la declaración del General de División 444, el Sr. Sessi, que está involucrado en varios casos penales, es detenido por el General de División 444, Hussein Al-Farjani Sassi, que está involucrado en varios casos penales graves.",,,,@gplusss
2025-11-17,22:19:24,Libia,Criminalidad,"El ex Consejero de Hafter: Libia ha estado viviendo la fase de la economía del crimen desde el fin de la era del Comandante Muammar Gaddafi • Mohamed Buyseer, ex asesor político de los Estados Unidos Khalifa Hafter, dijo que Libia ha vivido desde el final de la era del mártir Muammar Gaddafi, la etapa de la economía del crimen. • Buseer añadió en una intervención al canal Libya Liberal que desde entonces Libia ya no conocía la escuela, el hospital o la vida digna de los ciudadanos.",,,,@gplusss
2025-11-17,22:19:24,Libia,Otros,• Informe de la Corte Penal Internacional al Consejo de Seguridad en el que se confirma la existencia de nueve órdenes de detención declaradas que no se han ejecutado. • En el informe se afirma que se han realizado progresos en las investigaciones y que el equipo de la Corte ha reunido más de 1512 pruebas.,,,,@gplusss
2025-11-17,22:19:24,Libia,Otros,"Ben-Walid, fuentes de campo informaron de que una posición 444 de las milicias en el campamento de Jibraan fue atacada con un avión tripulado, sin que el ataque provocara daños humanos.",,,,@jraimalmlyshyat
2025-11-17,22:19:24,Libia,Otros,El Fiscal General ordena la detención de un ex funcionario de la Sección de Contabilidad de la Administración de las Subdirecciónes del Banco de la República de Trípoli en un caso de apropiación de 13 millones de dinares de los fondos del Banco.,,,,@libyapress
2025-11-17,22:19:24,Libia,Otros,El Gobierno paralelo de Hamad declara en una declaración que se suspenderá el trato con la Misión de las Naciones Unidas hasta que se retracte del acuerdo con Qatar de financiar un diálogo estructurado y lo denomine “aberrante y sospechoso”: condenamos y deploramos la conducta peligrosa y sin precedentes de la Misión de las Naciones Unidas mediante la firma de un acuerdo con el Estado de Qatar para financiar el llamado diálogo político estructurado.,,,,@libyapress
2025-11-17,22:19:25,Libia,Otros,"Dos meses después de casarse, el joven Mohamed Fathi Al-Zaydi se unió a él dos días después del accidente.",,,,@sefr0ly
2025-11-17,22:19:25,Libia,Otros,"Un video documenta un coche que atropella a un transeúnte cuando cruzan la carretera que conduce a la Dirección de Seguridad de Al-Khafra, un mes después de un incidente similar.",,,,@sefr0ly
2025-11-17,22:19:25,Libia,Otros,"A medida que los ciudadanos dependen cada vez más de los servicios de pago electrónico en sus transacciones financieras diarias, como se ha revelado en los informes de la Central, ¿el pago electrónico resuelve la actual crisis de liquidez asfixiante o no reemplaza a la del Cache?",,,,@sefr0ly
2025-11-17,22:19:25,Libia,Otros,"A pesar de que la misión ha ignorado a su gobierno en sus visitas y diálogos, el presidente del gobierno libio, Osama Hamad, anuncia el boicot de su gobierno a la UNSMIL después de firmar con la Embajada de Qatar un contrato para financiar el diálogo estructurado, una posición de coordinación con ella hasta que se disculpe.",,,,@sefr0ly
2025-11-17,22:22:16,Libia,Criminalidad,"- Si El Cairo no puede influir en la posición de los Emiratos Árabes Unidos, puede hablar con el Chad y con un alto peso sobre él, y tiene que adoptar una posición clara. - Los políticos no toleran los crímenes de los Emiratos Árabes Unidos y los de los Catastros de Sudán, Egipto lo condena, y si toma una posición contra los Emiratos Árabes Unidos, puede retirar sus miles de millones para enfrentar una crisis de liquidez.",,,,@sefr0ly
2025-11-17,22:23:26,Libia,Otros,La solución computacional de la complejidad: Unveiling the Mysteries of Algorithmic Efficiency  Introducción a la complejidad computacional La teoría de la complejidad computacional es un campo fascinante que se centra en el estudio de los recursos necesarios para resolver problemas computacionales.  [Enlace: https://libyaobserver.ly/cdn-cgi/content?id=ZNFxsO4nAPSA3.B5m5.IYheR2N1f2q_ZWdPOh8erxJA-1763411004.2803855-1.0.1.1-0gmI8Ivh9wJ9f0fkt897G7H7a2CRo3rk1NsQWwHBxbE],,,,WEB libyaobserver.ly
2025-11-17,22:29:15,Libia,Otros,"Apurado por escuchar el sonido de un paquete fuerte en el Ghozgjibran, la ciudad de Beni Walid, Libia.",,,,@gplusss
2025-11-17,22:29:15,Libia,Otros,"Misión de las Naciones Unidas: Hannah Tete celebra una reunión en línea abierta con los libios sobre la hoja de ruta política y el diálogo estructurado que se iniciará en breve. - La reunión se celebrará el martes 25 de noviembre, a las 18.00 horas, hora de Libia, a través de la aplicación de Zoom, en el marco de la serie ampliada de consultas de la Misión en Libia.",,,,@libyapress
2025-11-17,22:33:20,Libia,Otros,"Bioelectromagnetism: The Hidden Forces Within  Bioelectromagnetism: The Hidden Forces Within Bioelectromagnetism es el estudio de los campos eléctricos y magnéticos producidos por organismos vivos. Este fascinante campo de investigación se refiere a los campos magnéticos producidos por la actividad eléctrica de las células, los tejidos y los órganos.  [Enlace: https://libyaobserver.ly/cdn-cgi/content?id=px_Vua4Kh1GO3k2MPEx1MUh4phxZfBvbnU1L7fTtvI8-1763411598.8801296-1.0.1.1-8hJ3SIkHLjh2kwNvI872cLJInI26SKxleJE6OmQNL_8]",,,,WEB libyaobserver.ly
2025-11-17,22:34:16,Libia,Otros,Configurar una fábrica de licores locales al oeste de la ciudad de  de TV de frecuencia: HD: H11373,,,,@almasartvlibya
2025-11-17,22:35:15,Libia,Otros,"""Desafortunadamente, el aumento de la entrada de inmigrantes irregulares en el país se ha visto acompañado de la propagación de algunas prácticas foráneas, incluida la peor magia: la magia negra, si no hay una actitud seria del Estado y del pueblo libio contra el asentamiento, el rechazo del plan de Miloney y el TM, la respuesta de cualquier funcionario italiano y el cierre del gas en Italia hasta que se cancele el acuerdo de asentamiento.",,,,@jraimalmlyshyat
2025-11-17,22:36:05,Libia,Otros,Desenvolviendo los principios de la teoría de la teoría de la teoría de la tecnología de la tecnología de la tecnología de la tecnología de la tecnología de la tecnología de la tecnología de la tecnología de la tecnología de la tecnología de la tecnología de la tecnología de la tecnología de la tecnología de la tecnología de la tecnología de la tecnología de la tecnología de la tecnología de la información.  [Enlace: https://libyaobserver.ly/cdn-cgi/content?id=bJBHXQs8emao4cu1h5TNjCQexld9AboAKITGcDzSIl0-1763411763.0288239-1.0.1.1-nAv8v.Pher0LTjndicHCo.4lvnw8YuFQX.WpmMaEUmw],,,,WEB libyaobserver.ly
