fecha,hora,pais,categoria_sicu,descripcion,localizacion,lat,lon,fuente_URL
2025-11-22,11:12:53,Mali,Disturbios Civiles,"- Noticias en Malí en tiempo real e información en vivo  Un año en la primatura del general de división Abdoulaye Maïga: Un liderazgo afirmado bajo el sello del patriotismo, de la ...  [Enlace: https://www.maliweb.net/]",,,,WEB www.maliweb.net
2025-11-22,11:12:54,Mali,Disturbios Civiles,"- Noticias en Malí en tiempo real e información en vivo  Un año en la primatura del general de división Abdoulaye Maïga: Un liderazgo afirmado bajo el sello del patriotismo, de la ...  [Enlace: https://www.maliweb.net]",,,,WEB www.maliweb.net
2025-11-22,11:13:00,Mali,Terrorismo,En un primer semestre alarmante  Refugiados: Malí acoge a más de 230.000 Burkabè y nigerianos Francia: tráfico de residuos hacia África Kayes: las cisternas desviadas de su circuito oficial Manchester City Liverpool.com/category/política/seguridad/seguridad/terrorismo/ Refugiados: Malí acoge a más de 230.000 Burkinabè y nigerianos Francia: tráfico de residuos hacia África Kayes: las cisternas desviadas de su circuito oficial Manchester City la ciudad de Liverpool Liverpool: sumérguese en el corazón de un choque futbolístico con 1xBet!  [Enlace: https://www.journaldumali.com/category/politique/securite-terrorisme/],,,,WEB www.journaldumali.com
2025-11-22,11:13:08,Mali,Hazards,"COP30: noticias, podcasts, videos y análisis - RFI  La COP 30 de Belém ¿fue la cumbre de una ambición renovada? En Brasil, la COP30 pasa a las prórrogas, muy incierta sobre su resultado COP30 en Brasil: abandono de la hoja de ruta para salir de las energías fósiles Municipal 2026 en Francia, vigilancia frente a la amenaza informativa COP30 sobre el clima en Belém: las negociaciones lentas por un incendio y los desacuerdos COP30:  [Enlace: https://www.rfi.fr/fr/tag/cop30/]",,,,WEB www.rfi.fr
2025-11-22,11:13:09,Mali,Conflicto Armado,"La guerra de Israel-Gaza: noticias, podcasts, videos y análisis - RFI  Gaza: Hamas acusa a Israel de haber movido la línea amarilla que reduce el territorio palestino En la primera página: un plan de paz estadounidense favorable a Rusia Gaza: los ataques israelíes mortíferos continúan a pesar de la cesación del fuego Israel: visita del Centro de Coordinación Civil y Militar encargado de la posguerra en Gaza Los ataques de colonos, la otra guerra contra los palestinos Cisjordania ocupada: jóvenes colonos multiplican la violencia contra palestinos Israel vuelve a golpear al sur del Líbano, de...  [Enlace: https://www.rfi.fr/fr/tag/gaza/]",,,,WEB www.rfi.fr
2025-11-22,11:13:09,Mali,Conflicto Armado,"El Sudán: noticias, podcasts, videos y análisis - RFI  los paramilitares elogian los esfuerzos de paz de Trump, mientras que los europeos sancionan su número dos Sudán del Sur: un largo y doloroso camino hacia la independencia En el Sudán, las reacciones contrastadas a las declaraciones de Donald Trump sobre la guerra Sudán: Banald Trump sobre la guerra Sudán: Bahalf-Fasher es el epicentro mundial del sufrimiento humano, alerta Tom Fletcher, de l-Ocha-Sobre qué pasas, o te mueres: en Chad, los refugiados sudaneses cuentan su huida de El-Fasher [Sus preguntas] Mbappé-PSG: un brazo de hierro...  [Enlace: https://www.rfi.fr/fr/tag/soudan/]",,,,WEB www.rfi.fr
2025-11-22,11:45:38,Mali,Terrorismo,"A raíz de la solicitud de  y  el ejército turco comenzó a formar, en sus bases en  unidades de los ejércitos malienses y nigerianos en la guerra asimétrica según las normas de la OTAN para prepararlos para luchar contra los ataques de los terroristas yihadistas.",,,,@Malikibaru
2025-11-22,18:51:06,Mali,Criminalidad,"- Noticias, videos e infos en vivo  de drogas/ L.Bolís-de droga/ L-Animosidad de Rachida Dati con respecto al sector audiovisual público, - una actitud inédita para una Ministra de la cultura - El patrón de Nvidia, muy por sus resultados excepcionales, niega la existencia de una burbula en la I.A Precio del arroz - ¿En los mercados financieros, el viento ha girado.  [Enlace: https://www.lemonde.fr/trafic-de-drogue/]",,,,WEB www.lemonde.fr
